Country,Year,Raw Event,Desc
Canada,1990,Land Dispute Escalation,"A significant standoff between Indigenous people and government forces over land rights in Quebec, escalating into a months-long confrontation, significantly impacting discussions on Indigenous rights and land use."
Canada,1990,Economic Recession,"The country faced an economic downturn, affecting employment rates, leading to government intervention in monetary policy and financial support programs."
Canada,1990,Environmental Policy Reform,"Introduction of new policies aimed at protecting the environment, reflecting growing public concern over environmental issues and sustainability."
Canada,1991,Political Accord Failure,"A proposed set of constitutional amendments aimed at addressing various political and cultural issues failed in a national referendum, sparking widespread debate on national unity and provincial rights."
Canada,1991,International Trade Agreement,"Canada participated in negotiations for a major international trade agreement, aiming to reduce trade barriers and boost economic growth between North America and other regions."
Canada,1991,Tax Implementation,"The introduction of the Goods and Services Tax (GST), a value-added tax levied on most goods and services sold for domestic consumption, sparking widespread debate and controversy over taxation policy."
Canada,1991,Free Trade Expansion,"The expansion of the Free Trade Agreement to include Mexico, leading to the creation of the North American Free Trade Agreement (NAFTA), aimed at increasing trade and investment flows among these countries."
Canada,1991,Military Engagement,"Canadian armed forces were deployed in an international conflict, marking a significant involvement in global military operations and peacekeeping efforts."
Canada,1992,Fisheries Crisis,"The government declared a moratorium on cod fishing in eastern waters due to collapsing fish stocks, affecting the livelihoods of thousands and sparking a reevaluation of fishing policies and conservation efforts."
Canada,1992,Constitutional Debate Continues,"Continued debates and discussions on constitutional reform following the failure of previous accords, aiming to address ongoing issues of federalism, provincial rights, and Indigenous relations."
Canada,1992,Cod Fishing Moratorium,"The government imposed a moratorium on the Northern Cod fishery off the East Coast due to severe overfishing, impacting local economies and sparking debates on fisheries management and environmental conservation."
Canada,1992,Environmental Summit Participation,"Canada played a significant role in a global environmental summit, committing to international agreements on environmental protection and sustainability."
Canada,1993,Peacekeeping Efforts,"Canada's increased involvement in international peacekeeping missions, demonstrating its commitment to global peace and security through contributions to United Nations missions."
Canada,1993,Political Shift,"A significant shift in federal politics with the election of a new government, leading to changes in national policy on finance, social programs, and international relations."
Canada,1993,Trade Agreement Implementation,"The implementation of a significant trade agreement with the United States and Mexico, aiming to create one of the world's largest free trade zones and impacting the economy and trade relations."
Canada,1993,Natural Disaster Response,"A major natural disaster prompted a significant emergency response, leading to discussions on disaster preparedness, climate change, and environmental management."
Canada,1994,Health Care Reform,"Major reforms to the national health care system were initiated, aiming to address challenges of accessibility, funding, and quality of care."
Canada,1994,Public Safety Legislation,"Introduction of significant legislation aimed at improving public safety, including measures on crime prevention, law enforcement, and justice system reform."
Canada,1994,Trade Agreement Implementation,"The North American Free Trade Agreement (NAFTA) came into effect, integrating Canada more deeply with the United States and Mexico, aiming to eliminate trade barriers and increase investment opportunities."
Canada,1994,Political Referendum,"A referendum in Quebec on whether to pursue sovereignty was narrowly defeated, indicating deep divisions on the issue of Quebec's independence from Canada and sparking nationwide discussions on national unity and constitutional change."
Canada,1995,Sovereignty Referendum,"Another closely contested referendum in Quebec on sovereignty came within a narrow margin of leading to the province's independence, highlighting the ongoing debate over Quebec's status within Canada and prompting discussions on federalism and national identity."
Canada,1995,Quebec Referendum,"A referendum in Quebec on independence from Canada, which narrowly resulted in a decision to remain part of Canada, significantly impacting national unity and discussions on federalism and regional autonomy."
Canada,1995,Fiscal Consolidation,"The federal government's implementation of stringent fiscal consolidation measures to address the national deficit and debt, resulting in spending cuts and tax adjustments, impacting public services and economic policy."
Canada,1995,Federal Budget Reforms,"The government introduced a landmark federal budget aimed at reducing the national deficit through significant cuts to public spending, which had profound effects on social programs, sparking debates on fiscal responsibility and social welfare."
Canada,1995,Major Legal Decision,"The Supreme Court made a landmark ruling on indigenous land rights, significantly impacting the relationship between the government and Indigenous peoples, leading to new approaches in negotiations and land claims settlements."
Canada,1996,Indigenous Residential Schools Settlement,"The government began steps to address the legacy of Indigenous residential schools, including initiatives for reconciliation and compensation for survivors, marking a critical moment in acknowledging historical injustices."
Canada,1996,Education Reform,"Major reforms were implemented in the education system in several provinces, aiming to improve efficiency and outcomes but sparking debates over funding, governance, and educational quality."
Canada,1996,Health Care Reform,"Significant health care reform efforts were undertaken to address sustainability and accessibility of the public health care system, leading to debates on health care funding, delivery, and the principles of the Canada Health Act."
Canada,1996,Telecommunications Expansion,"The government introduced measures to increase competition and innovation in the telecommunications sector, aiming to improve services and access to digital technology across the country."
Canada,1997,Financial Crisis Response,"Canada responded to the Asian financial crisis by implementing measures to protect its economy, demonstrating the interconnectedness of global markets and the need for prudent economic management."
Canada,1997,Environmental Protocol Signing,"Canada signed the Kyoto Protocol, committing to reducing greenhouse gas emissions and highlighting the country's commitment to addressing global climate change."
Canada,1997,Kyoto Protocol Participation,"Canada's commitment to the Kyoto Protocol, an international treaty to reduce greenhouse gas emissions, highlighting its role in global environmental efforts."
Canada,1997,Major Infrastructure Project,"The Confederation Bridge was opened, connecting Prince Edward Island with mainland New Brunswick, representing a significant engineering achievement and facilitating economic and social connectivity."
Canada,1998,Ice Storm,"A severe ice storm struck eastern Canada, causing widespread power outages and damage, highlighting the challenges of disaster response and the need for effective emergency management strategies."
Canada,1998,Supreme Court Decision on Secession,"The Supreme Court ruled on the legality of Quebec secession, stating it could not legally secede without a clear vote on independence and negotiations with the federal government, clarifying constitutional questions on secession."
Canada,1998,Indigenous Rights Agreement,"The Nisga'a Treaty was signed in British Columbia, marking a significant land claims agreement between the government and the Nisga'a Nation, setting a precedent for future negotiations with Indigenous peoples."
Canada,1999,Creation of Nunavut,"The creation of Nunavut as a separate territory, aimed at providing greater self-determination for the Inuit population, representing a significant development in Canada's approach to Indigenous governance and territorial management."
Canada,1999,Supreme Court Ruling on Rights,"A landmark Supreme Court decision expanded the rights of LGBTQ+ individuals, influencing subsequent legislation and societal attitudes towards LGBTQ+ rights and equality."
Canada,1999,Immigration Policy Reform,"The government implemented significant reforms to immigration policy, aiming to attract skilled immigrants and address demographic challenges, impacting Canada's social and economic landscape."
Canada,1999,Financial Legislation Reform,"The government enacted significant reforms to the financial sector, aimed at enhancing regulation, consumer protection, and the stability of the financial system."
Canada,2000,Technological Innovation Initiative,"The government launched initiatives to promote technological innovation and the digital economy, aiming to position Canada as a leader in information technology and innovation."
Canada,2000,Health Agreement,"A major accord on health care funding and reform was reached between the federal and provincial governments, aiming to improve the sustainability and quality of health care services across the country."
Canada,2000,Public Safety Legislation,"In response to growing concerns about public safety and security, new legislation was introduced to enhance law enforcement capabilities and protect citizens, reflecting the evolving challenges in maintaining public safety."
Canada,2001,Anti-Terrorism Measures,"Following global events, Canada introduced comprehensive anti-terrorism legislation, aiming to prevent terrorist activities while balancing civil liberties, reflecting the global shift towards heightened security concerns."
Canada,2001,Economic Stimulus,"In response to economic challenges, the government implemented stimulus measures to support economic growth and stability, reflecting the need for proactive fiscal policy in times of economic downturn."
Canada,2001,Immigration Policy Reform,"Significant reforms to immigration policy were introduced, aiming to attract skilled immigrants while addressing security concerns, reflecting the importance of immigration to Canada's demographic and economic strategy."
Canada,2002,Education Reform,"Initiatives to reform the education system, focusing on improving access, quality, and outcomes in primary, secondary, and post-secondary education, reflecting the importance of education in social and economic development."
Canada,2002,Environmental Protection Initiatives,"The launch of new initiatives to protect the environment, including conservation efforts and policies to address climate change, demonstrating Canada's commitment to environmental stewardship."
Canada,2002,Health Epidemic Response,"Canada faced a significant public health challenge with the outbreak of the severe acute respiratory syndrome (SARS), leading to a national and international response to contain the spread and address public health concerns."
Canada,2002,Agricultural Crisis,"A major crisis in the agricultural sector occurred due to disease outbreaks in livestock, leading to significant economic impacts and prompting discussions on agricultural practices and food safety."
Canada,2002,Trade Dispute Resolution,"Canada resolved a long-standing trade dispute with a major trading partner, leading to improved trade relations and highlighting the importance of diplomacy and international trade agreements."
Canada,2003,SARS Outbreak,"A severe acute respiratory syndrome (SARS) outbreak occurred, primarily affecting Toronto, leading to significant health concerns, a temporary impact on the economy, and international travel advisories."
Canada,2003,Power Outage,"A massive power outage affected large parts of eastern Canada and the northeastern United States, highlighting the vulnerability of critical infrastructure and the need for enhanced grid security and reliability."
Canada,2003,Same-Sex Marriage Legislation,"The country moved towards legalizing same-sex marriage, with courts in several provinces ruling in favor of equality, setting a precedent for nationwide legislation in 2005."
Canada,2003,Political Scandal,"A significant political scandal involving government contracts and corruption was uncovered, leading to widespread public outcry, political reforms, and a shift in the political landscape."
Canada,2003,Environmental Conservation Plan,"The government announced a comprehensive plan for environmental conservation and protection, aiming to address climate change, protect natural habitats, and promote sustainable development."
Canada,2004,Federal Election,"A federal election resulted in a minority government, signaling a shift in the political landscape and leading to discussions about coalition governance and political stability."
Canada,2004,Health Care Accord,"A new health care accord was signed by federal and provincial governments, aiming to ensure long-term sustainability of the health care system and improve access and quality of care for Canadians."
Canada,2004,Same-Sex Marriage Legislation,"Legislation was passed to legalize same-sex marriage across the country, marking a significant advancement in human rights and equality."
Canada,2004,National Security Policy,"The government introduced a national security policy aimed at enhancing the country's security infrastructure and preparedness in response to global threats, emphasizing the importance of national security in a changing global context."
Canada,2005,Foreign Policy Shift,"Canada announced a shift in its foreign policy priorities, focusing on new global partnerships, peacekeeping, and international development, reflecting changes in the global political landscape and Canada's role in it."
Canada,2005,Civil Union Legislation,"Nationwide legalization of same-sex marriage, establishing Canada as one of the first countries to adopt such legislation, reflecting a significant advancement in LGBTQ+ rights."
Canada,2005,Kyoto Protocol Commitment,"Canada reaffirmed its commitment to the Kyoto Protocol, emphasizing environmental policy and climate change initiatives, despite debates on economic impacts and implementation challenges."
Canada,2005,Public Health Initiative,"A major public health initiative was launched to improve health outcomes and address chronic diseases, emphasizing the importance of public health in national policy."
Canada,2005,Indigenous Rights Movement,"Significant movements and legal challenges related to Indigenous rights and land claims gained prominence, leading to increased awareness and discussions on Indigenous issues and rights."
Canada,2006,Political Change,"A change in government following a federal election led to shifts in policy direction, including changes in taxation, environmental policy, and international relations, reflecting the dynamic nature of democratic governance."
Canada,2006,Environmental Initiative,"A major initiative aimed at addressing climate change and promoting environmental sustainability was launched, reflecting the growing importance of environmental issues in public policy."
Canada,2006,International Peacekeeping,"Canada increased its involvement in international peacekeeping missions, demonstrating its commitment to global peace and security."
Canada,2006,Change in Government,"A federal election led to a change in government, marking a shift towards conservative policies and redefining Canada's approach to fiscal management, social policy, and international relations."
Canada,2007,Arctic Sovereignty,"Canada increased its focus on asserting sovereignty in the Arctic, responding to climate change, potential resource claims, and strategic geopolitical interests in the region."
Canada,2007,Economic Boom,"Canada experienced an economic boom, driven by high commodity prices and strong demand for natural resources, highlighting the importance of natural resources in the Canadian economy."
Canada,2007,Constitutional Discussions,"Discussions on constitutional reform and the division of powers between federal and provincial governments were prominent, reflecting ongoing debates on governance and federalism."
Canada,2007,Indigenous Land Agreement,"A landmark land claim agreement was reached with an Indigenous group, marking a significant step in addressing historical grievances and promoting reconciliation."
Canada,2008,Global Financial Crisis Impact,"The global financial crisis had a significant impact on Canada's economy, leading to government interventions and policy measures aimed at stabilizing the economy and protecting jobs."
Canada,2008,Environmental Policy Reform,"The government introduced significant reforms to environmental policy, aiming to reduce greenhouse gas emissions and promote sustainable development practices."
Canada,2008,Apology to Indigenous Peoples,"The government issued a formal apology to Indigenous peoples for historical injustices, marking an important step in the process of reconciliation and healing."
Canada,2009,Economic Stimulus,"In response to the global financial crisis, the government launched a significant economic stimulus package, aiming to support the economy, preserve jobs, and stimulate growth."
Canada,2009,Olympic Preparation,"Vancouver prepared to host the 2010 Winter Olympics, involving significant infrastructure projects, national pride, and discussions on the economic and environmental impacts of hosting the Games."
Canada,2009,H1N1 Pandemic Response,"Faced with the H1N1 influenza pandemic, Canada implemented a nationwide vaccination campaign and public health measures to mitigate the impact of the virus."
Canada,2009,Climate Change Action,"Canada participated in international climate change negotiations, facing criticism for its environmental policies and commitments to reducing greenhouse gas emissions."
Canada,2010,Hosting International Event,"Canada hosted a major international sports event, showcasing the country to a global audience and prompting discussions on national identity, infrastructure, and legacy."
Canada,2010,Indigenous Rights Declaration,"Canada endorsed a significant international declaration on the rights of Indigenous peoples, reflecting a shift in policy and recognition of Indigenous rights."
Canada,2010,Vancouver Winter Olympics,"Canada hosted the Winter Olympics, showcasing the country on the international stage, achieving significant athletic success, and fostering a sense of national unity and pride."
Canada,2010,G20 Summit in Toronto,"The G20 summit held in Toronto led to large-scale protests, discussions on global economic policy, and debates over security measures and the right to peaceful protest."
Canada,2010,Military Withdrawal,"Canada began the process of withdrawing its combat forces from an international military mission, marking the end of a significant military engagement and prompting discussions on the role of the military and foreign policy."
Canada,2011,Federal Election,"A national election resulted in the first majority government in nearly a decade, significantly shifting the political landscape and policy direction in Canada."
Canada,2011,Withdrawal from Kyoto Protocol,"Canada announced its intention to withdraw from the Kyoto Protocol, sparking debates on climate policy, environmental responsibility, and international commitments."
Canada,2011,Military Mission Conclusion,"The country officially ended its combat operations in a foreign conflict, transitioning to a training mission, reflecting a shift in military and foreign policy."
Canada,2011,Natural Disaster,"A significant earthquake and subsequent tsunami in a foreign country led Canada to contribute to international relief efforts, showcasing its commitment to global aid and cooperation."
Canada,2012,Education Protests,"Large-scale student protests erupted over tuition fee hikes in Quebec, leading to widespread demonstrations, discussions on education affordability, and political repercussions."
Canada,2012,Trade Agreement Negotiations,"Canada entered into negotiations for a comprehensive trade agreement with the European Union, aiming to enhance trade relations and economic growth."
Canada,2012,Natural Disaster,"Extensive flooding in parts of British Columbia and Ontario, causing significant damage to homes and infrastructure, prompting emergency responses and discussions on climate change impact."
Canada,2012,Indigenous Rights Movement,"A grassroots movement, sparked by opposition to proposed federal legislation, grew into a broader advocacy for Indigenous rights, leading to nationwide attention and governmental dialogue."
Canada,2012,Energy Project Controversy,"Public debate intensified over a proposed pipeline project, highlighting environmental concerns, Indigenous rights, and the nation's energy policy."
Canada,2012,Scientific Discovery,"Canadian scientists contributed to a major international scientific discovery, emphasizing the country's role in global scientific research and innovation."
Canada,2012,Sports Achievement,"Canadian athletes achieved notable success in international competition, bolstering national pride and highlighting the importance of sports and physical activity."
Canada,2012,Environmental Policy,"The government announced significant changes to environmental legislation, prompting discussions on conservation, resource management, and sustainability."
Canada,2012,Energy Project Controversy,"A proposed pipeline project to transport crude oil from Alberta to coastal ports faced significant environmental and Indigenous opposition, sparking a national debate on energy, environment, and Indigenous rights."
Canada,2013,Transportation Disaster,"A tragic derailment of a freight train carrying crude oil in Quebec resulted in explosions, significant loss of life, and destruction, leading to nationwide discussions on transportation safety and regulations."
Canada,2013,Senate Expenses Scandal,"A scandal involving inappropriate expense claims by members of the Senate led to public outcry, legal actions, and debates on governance and accountability in parliamentary institutions."
Canada,2013,Political Scandal,"A scandal involving the misuse of funds by government officials led to public outcry, legal proceedings, and debates on accountability and ethics in politics."
Canada,2013,Technological Innovation,"A Canadian technology company made significant advancements, impacting the global tech industry and emphasizing Canada's role in technological development."
Canada,2013,Labor Strike,"A significant labor strike in a major sector highlighted issues related to workers' rights, wages, and working conditions, affecting national discussions on labor laws and economic policies."
Canada,2013,Immigration Reform,"The government implemented changes to immigration policy, affecting the process for immigrants and refugees, and sparking discussions on multiculturalism and demographic changes."
Canada,2013,Health Crisis,"An outbreak of a contagious disease prompted a national public health response, raising questions about healthcare preparedness and public safety."
Canada,2013,Cultural Milestone,"A Canadian cultural event or achievement gained international recognition, showcasing Canada's contributions to arts and culture on the global stage."
Canada,2013,International Diplomacy,"Canada engaged in significant diplomatic efforts on an international issue, affecting global relations and emphasizing the country's role on the world stage."
Canada,2013,Climate Action Plan,"The government announced initiatives aimed at reducing carbon emissions and combating climate change, reflecting growing environmental awareness and the push for sustainability."
Canada,2013,Indigenous Rights Movement,"The ""Idle No More"" movement gained momentum, advocating for Indigenous rights, sovereignty, and environmental protection, influencing public policy and national discourse."
Canada,2014,Terrorist Attacks,"Two separate attacks in Ottawa and Quebec by individuals inspired by extremist ideologies targeted military personnel, leading to a national conversation on terrorism, security, and civil liberties."
Canada,2014,Supreme Court Landmark Decision,"The Supreme Court recognized Indigenous land title rights in an unprecedented ruling, affecting land use negotiations and Indigenous sovereignty across the country."
Canada,2014,Public Health Response,"Canada contributed medical staff and resources to combat the Ebola virus outbreak in West Africa, demonstrating its commitment to global health and humanitarian assistance."
Canada,2015,Federal Election,"A significant election led to a change in government, with the Liberal Party winning a majority, focusing on promises of change, including environmental policies, Indigenous relations, and social justice."
Canada,2015,Syrian Refugee Resettlement,"Canada initiated a large-scale resettlement program for Syrian refugees, emphasizing humanitarian support and multiculturalism, and welcoming tens of thousands of refugees."
Canada,2015,Economic Recession,"The country entered a technical recession, driven by falling oil prices and global economic pressures, leading to debates on economic policy, diversification, and fiscal management."
