Country,Year,Raw Event,Desc
Canada,2016,Wildfires,"Massive wildfires in Fort McMurray, Alberta, led to one of the largest evacuations in Canadian history, highlighting issues related to climate change, emergency response, and community resilience."
Canada,2016,Assisted Dying Legislation,"Canada passed federal legislation allowing medically assisted dying under certain conditions, sparking ethical, legal, and healthcare debates across the country."
Canada,2016,Indigenous Inquiry,"The government launched a national inquiry into missing and murdered Indigenous women and girls, addressing long-standing issues of violence, systemic racism, and justice."
Canada,2017,NAFTA Renegotiations,"Amidst changing U.S. trade policies, Canada engaged in renegotiations of the North American Free Trade Agreement, addressing challenges and opportunities in international trade and economic relations."
Canada,2017,Cannabis Legalization Announcement,"The government announced plans to legalize recreational cannabis, leading to discussions on regulation, public health, and criminal justice reform."
Canada,2017,Major Apology,"The Prime Minister issued a formal apology to LGBTQ+ Canadians for historical injustices and discrimination, reinforcing commitments to equality and human rights."
Canada,2018,Trade Agreement Signed,"Canada, the United States, and Mexico signed the USMCA, replacing NAFTA and marking a significant development in North American trade relations."
Canada,2018,Diplomatic Dispute,"A diplomatic dispute with a major Middle Eastern country over human rights led to expulsions and heightened tensions, reflecting Canada's stance on human rights advocacy."
Canada,2018,Indigenous Rights Framework,"The government proposed a framework for recognizing Indigenous rights, aiming to transform relationships, though facing mixed reactions regarding its implementation and impact."
Canada,2019,Federal Election,"A federal election resulted in a minority government, emphasizing regional divisions, climate"
Canada,2011,Federal Election,"A national election resulted in the first majority government in nearly a decade, significantly shifting the political landscape and policy direction in Canada."
Canada,2011,Military Mission Conclusion,"The country officially ended its combat operations in a foreign conflict, transitioning to a training mission, reflecting a shift in military and foreign policy."
Canada,2011,Natural Disaster,"A significant earthquake and subsequent tsunami in a foreign country led Canada to contribute to international relief efforts, showcasing its commitment to global aid and cooperation."
Canada,2012,Education Protests,"Large-scale student protests erupted over tuition fee hikes in Quebec, leading to widespread demonstrations, discussions on education affordability, and political repercussions."
Canada,2012,Trade Agreement Negotiations,"Canada entered into negotiations for a comprehensive trade agreement with the European Union, aiming to enhance trade relations and economic growth."
Canada,2012,Energy Project Controversy,"A proposed pipeline project to transport crude oil from Alberta to coastal ports faced significant environmental and Indigenous opposition, sparking a national debate on energy, environment, and Indigenous rights."
Canada,2013,Transportation Disaster,"A tragic derailment of a freight train carrying crude oil in Quebec resulted in explosions, significant loss of life, and destruction, leading to nationwide discussions on transportation safety and regulations."
Canada,2013,Senate Expenses Scandal,"A scandal involving inappropriate expense claims by members of the Senate led to public outcry, legal actions, and debates on governance and accountability in parliamentary institutions."
Canada,2013,Indigenous Rights Movement,"The ""Idle No More"" movement gained momentum, advocating for Indigenous rights, sovereignty, and environmental protection, influencing public policy and national discourse."
Canada,2014,National Security Incident,"A security incident on national soil led to increased public safety measures, discussions on national security, and the balance between safety and civil liberties."
Canada,2014,Economic Downturn,"A downturn in the global economy impacted Canada, leading to discussions on economic resilience, fiscal policy, and support for affected sectors."
Canada,2014,Indigenous Land Rights Decision,"A landmark court decision recognized Indigenous land rights, impacting land use, resource development, and Indigenous-government relations."
Canada,2014,Healthcare Innovation,"Breakthroughs in healthcare, including research and treatment innovations, underscored the importance of investment in health sciences and patient care."
Canada,2014,International Sporting Event,"Canada hosted an international sporting event, promoting cultural exchange, tourism, and national pride, while highlighting the importance of sports in fostering global unity."
Canada,2014,Environmental Protest,"Protests against environmental policies and projects, including pipeline expansions, emphasized the national debate over environmental stewardship and economic development."
Canada,2014,Public Education Reform,"Reforms in the public education system sparked debates on curriculum changes, educational funding, and the future of public schooling in Canada."
Canada,2014,Technological Breakthrough,"A Canadian company or research team made a significant technological breakthrough, impacting the global technology landscape and innovation within the country."
Canada,2014,Terrorist Attacks,"Two separate attacks in Ottawa and Quebec by individuals inspired by extremist ideologies targeted military personnel, leading to a national conversation on terrorism, security, and civil liberties."
Canada,2014,Supreme Court Landmark Decision,"The Supreme Court recognized Indigenous land title rights in an unprecedented ruling, affecting land use negotiations and Indigenous sovereignty across the country."
Canada,2014,Public Health Response,"Canada contributed medical staff and resources to combat the Ebola virus outbreak in West Africa, demonstrating its commitment to global health and humanitarian assistance."
Canada,2015,Federal Election,"A significant election led to a change in government, with the Liberal Party winning a majority, focusing on promises of change, including environmental policies, Indigenous relations, and social justice."
Canada,2015,Syrian Refugee Resettlement,"Canada initiated a large-scale resettlement program for Syrian refugees, emphasizing humanitarian support and multiculturalism, and welcoming tens of thousands of refugees."
Canada,2015,Federal Election,"A federal election led to a change in government, impacting the country's direction in terms of social, economic, and environmental policies."
Canada,2015,International Trade Agreement Signed,"Canada signed a significant international trade agreement, aiming to boost the economy."
Canada,2015,Economic Recession,"The country entered a technical recession, driven by falling oil prices and global economic pressures, leading to debates on economic policy, diversification, and fiscal management."
Canada,2016,Wildfires,"Massive wildfires in Fort McMurray, Alberta, led to one of the largest evacuations in Canadian history, highlighting issues related to climate change, emergency response, and community resilience."
Canada,2016,Assisted Dying Legislation,"Canada passed federal legislation allowing medically assisted dying under certain conditions, sparking ethical, legal, and healthcare debates across the country."
Canada,2016,Indigenous Inquiry,"The government launched a national inquiry into missing and murdered Indigenous women and girls, addressing long-standing issues of violence, systemic racism, and justice."
Canada,2017,NAFTA Renegotiations,"Amidst changing U.S. trade policies, Canada engaged in renegotiations of the North American Free Trade Agreement, addressing challenges and opportunities in international trade and economic relations."
Canada,2017,Cannabis Legalization Announcement,"The government announced plans to legalize recreational cannabis, leading to discussions on regulation, public health, and criminal justice reform."
Canada,2017,Major Apology,"The Prime Minister issued a formal apology to LGBTQ+ Canadians for historical injustices and discrimination, reinforcing commitments to equality and human rights."
Canada,2018,Trade Agreement Signed,"Canada, the United States, and Mexico signed the USMCA, replacing NAFTA and marking a significant development in North American trade relations."
Canada,2018,Diplomatic Dispute,"A diplomatic dispute with a major Middle Eastern country over human rights led to expulsions and heightened tensions, reflecting Canada's stance on human rights advocacy."
Canada,2018,Indigenous Rights Framework,"The government proposed a framework for recognizing Indigenous rights, aiming to transform relationships, though facing mixed reactions regarding its implementation and impact."
Canada,2019,Federal Election,"A federal election resulted in a minority government, emphasizing regional divisions, climate policy, and national unity in the political discourse."
Canada,2019,Climate Action Protests,"Nationwide protests, inspired by global movements, called for urgent action on climate change, influencing public policy and political debate on environmental issues."
Canada,2019,Indigenous Land Dispute Escalation,"A dispute over a gas pipeline project in British Columbia led to nationwide solidarity protests, blockades, and discussions on Indigenous sovereignty and environmental protection."
Canada,2020,COVID-19 Pandemic Response,"The outbreak of the COVID-19 pandemic led to nationwide lockdowns, public health crises, and significant governmental responses to mitigate health and economic impacts."
Canada,2020,Anti-Racism Protests,"Following global movements, Canada saw widespread protests against systemic racism and police brutality, emphasizing social justice and equality within Canadian society."
Canada,2020,Economic Stimulus Measures,"In response to the pandemic, the government implemented significant economic stimulus measures, supporting individuals, businesses, and sectors impacted by COVID-19 disruptions."
Canada,2021,Residential School Discoveries,"The discovery of unmarked graves at former residential school sites triggered a national reckoning with historical injustices against Indigenous peoples, leading to calls for action and reconciliation."
Canada,2021,Heatwave and Wildfires,"A record-breaking heatwave and subsequent wildfires across Western Canada underscored the impacts of climate change, prompting discussions on environmental policy and emergency preparedness."
Canada,2021,Federal Election,"A snap federal election resulted in another minority government, with debates centering on pandemic management, climate action, and affordability issues."
Canada,2022,Ukraine Conflict Support,"In response to the conflict in Ukraine, Canada provided military and humanitarian support, reinforcing its commitment to international alliances and human rights."
Canada,2022,Healthcare Funding Crisis,"Amidst the ongoing pandemic, the country faced a healthcare funding and staffing crisis, leading to debates on the sustainability and future of the healthcare system."
Canada,2022,Indigenous Reconciliation Actions,"The government took steps towards reconciliation with Indigenous peoples, including land agreements and policy reforms, though challenges and criticisms of the pace of change persisted."
Canada,2023,Economic Challenges,"Faced with inflation and economic uncertainty, Canada implemented policies aimed at stabilizing the economy, addressing cost of living, and supporting sectors in need."
Canada,2023,Environmental Legislation,"New environmental legislation aimed at reducing carbon emissions and promoting sustainability was introduced, reflecting ongoing commitments to climate change mitigation."
Canada,2023,Technological Innovation Strategy,"The government announced a strategy to promote technological innovation and competitiveness, focusing on digital infrastructure, cybersecurity, and the tech industry's growth."
