Country,Year,Raw Event,Desc
Cuba,2015,Historic Visit,"A historic visit by a foreign leader, the first in decades, symbolizing a new phase in diplomatic and economic relations, and sparking discussions on future cooperation."
Cuba,2016,Economic Challenges,"Facing economic challenges, including reduced aid from key allies and the impact of global economic conditions, prompting discussions on economic diversification and resilience."
Cuba,2016,Cultural Exchange Enhancement,"Enhancement of cultural exchange programs, including art, dance, and music, reinforcing Cuba's cultural influence and fostering international goodwill."
Cuba,2016,Sustainable Tourism Development,Focus on sustainable tourism development to leverage natural and cultural assets while protecting the environment and promoting social inclusion.
Cuba,2016,Leadership Legacy,"The passing of a historic leader, marking the end of an era and prompting reflections on the country's future direction, legacy, and ongoing reforms."
Cuba,2016,Hurricane Matthew Response,"Response to Hurricane Matthew, showcasing effective disaster management and community resilience in the face of significant destruction in eastern regions."
Cuba,2017,Policy Reversal,"A policy reversal by a major trading partner, tightening restrictions and impacting bilateral relations, economic initiatives, and discussions on sovereignty and independence."
Cuba,2017,Internet Expansion,"Continued efforts to expand internet access, including the introduction of mobile internet services, reflecting ongoing digital transformation and challenges."
Cuba,2017,Renewable Energy Focus,"Increased focus on renewable energy projects to address climate change and energy security, including solar energy farms and wind energy projects."
Cuba,2017,Private Sector Regulation,"Introduction of new regulations for the private sector, aiming to organize and control the growing entrepreneurial activities while supporting economic development."
Cuba,2017,International Solidarity,"Strengthening of international solidarity movements in support of lifting economic restrictions and promoting peace, showcasing global support for Cuba's sovereignty."
Cuba,2018,Constitutional Referendum,"A referendum on a new constitution, reflecting updates on property rights, marriage equality, and the role of the market in the economy, indicating a significant step in Cuba's political and social evolution."
Cuba,2018,Leadership Transition,"A new president assumes office, marking the first time in decades the country is led by someone outside the historic leadership's family, indicating a potential for continued reforms."
Cuba,2018,Environmental Initiatives,"Launch of environmental initiatives aimed at conservation, sustainable development, and addressing the impacts of climate change on the island."
Cuba,2018,International Healthcare Contribution,"Continuation of international healthcare contributions, with Cuban doctors providing services in underserved areas globally, reinforcing Cuba's role in global health diplomacy."
Cuba,2018,Science and Technology Advancement,"Advancements in science and technology, particularly in biotech and pharmaceutical sectors, showcasing Cuba's innovation and contribution to global health solutions."
Cuba,2019,Fuel Shortage Crisis,"A fuel shortage crisis, impacting transportation, agriculture, and daily life, reflecting vulnerabilities in the energy sector and prompting government and community responses."
Cuba,2019,Mobile Internet Accessibility,"Expansion of mobile internet accessibility, significantly increasing digital participation, access to information, and connectivity for Cubans."
Cuba,2019,International Sports Performance,"Strong performance in international sports competitions, underscoring the importance of sports in national identity and international prestige."
Cuba,2019,Economic Measures,"Introduction of economic measures to tackle shortages and stabilize the economy, including food distribution controls and incentives for agricultural production."
Cuba,2019,Diplomatic Engagement,"Active diplomatic engagement to strengthen alliances, advocate for the lifting of economic sanctions, and promote international cooperation and development."
Cuba,2020,COVID-19 Pandemic Response,"Effective response to the COVID-19 pandemic, including public health measures, development of vaccines, and international medical assistance, showcasing the strengths of the Cuban healthcare system."
Cuba,2020,Economic Reforms Acceleration,"Acceleration of economic reforms in response to the pandemic's economic impact, including expansion of the private sector and introduction of monetary reforms."
Cuba,2020,Social Media and Protests,"Rise in social media usage leading to increased public discourse and demonstrations, reflecting growing demands for economic improvements and freedom of expression."
Cuba,2020,International Medical Brigades,"Deployment of medical brigades to assist other countries in fighting the COVID-19 pandemic, reinforcing Cuba's commitment to international solidarity in health."
Cuba,2020,US Sanctions Impact,"Tightening of US sanctions, exacerbating economic challenges and impacting sectors from remittances to tourism, fueling debates on international law and sovereignty."
Cuba,2021,Protests and Social Unrest,"Large-scale protests erupting in response to economic hardships, shortages, and demands for political change, marking a significant moment in Cuba's recent history."
Cuba,2021,Vaccine Development,"Successful development and rollout of domestically produced COVID-19 vaccines, demonstrating Cuba's biotechnological capabilities and commitment to public health."
Cuba,2021,Economic Policy Updates,"Updates to economic policy to address the crisis, including currency unification, increased allowance for private businesses, and efforts to attract foreign investment."
Cuba,2021,International Relations Efforts,"Efforts to improve international relations and advocate for the lifting of sanctions, including engagement with global organizations and bilateral discussions."
Cuba,2021,Energy Sector Challenges,"Challenges in the energy sector, including electricity shortages and fuel scarcity, prompting discussions on energy policy, sustainability, and investment needs."
Cuba,2022,Monetary Reforms Impact,"Continuing impact of monetary reforms, including inflation and adjustments in the economy, leading to ongoing analysis and policy adjustments."
Cuba,2022,Digital Transformation,"Advances in digital transformation, including e-commerce, online services, and increased internet penetration, impacting education, business, and government services."
Cuba,2022,Environmental Sustainability Initiatives,"Implementation of initiatives for environmental sustainability, including reforestation, coastal protection, and sustainable agriculture practices."
Cuba,2022,Cultural Heritage and Tourism,"Promotion of cultural heritage and adaptation of the tourism sector to new realities, emphasizing sustainable and cultural tourism as economic drivers."
Cuba,2022,Social Policy Adjustments,"Adjustments to social policies to better address public health, education, and social welfare needs, reflecting the government's response to public demands and economic conditions."
Cuba,2023,Economic Stabilization Efforts,"Efforts towards economic stabilization, including measures to improve productivity, increase exports, and stabilize the currency, amid global economic challenges."
Cuba,2023,Renewable Energy Projects,"Expansion of renewable energy projects to address climate change and reduce dependency on imported fuels, including solar and wind energy developments."
Cuba,2023,International Collaboration,"Strengthening of international collaboration, including health, education, and sustainable development projects, enhancing Cuba's role on the international stage."
Cuba,2023,Technological Innovation,"Emphasis on technological innovation, particularly in biotechnology and information technology sectors, aiming to boost economic growth and address societal challenges."
Cuba,2023,Public Engagement and Dialogue,"Increased public engagement and dialogue on reforms, governance, and social issues, reflecting a gradual opening for public discourse and participation."
