Country,Year,Raw Event,Desc
Cuba,1990,Economic Crisis Begins,"The collapse of the Soviet Union initiated a severe economic downturn in Cuba, known as the ""Special Period,"" significantly impacting food, fuel, and basic necessities across the island."
Cuba,1990,International Relations,"Cuba's international isolation increased as the Eastern Bloc dissolved, leading to a reevaluation of foreign policies and economic strategies within a changing global context."
Cuba,1990,Energy Shortages,"The dissolution of trade agreements with the Soviet Union led to acute energy shortages, affecting transportation, industry, and daily life for Cubans."
Cuba,1990,Agricultural Reforms,"The government initiated agricultural reforms to combat food shortages, encouraging organic farming and urban agriculture as a response to the economic crisis."
Cuba,1990,Tourism Emphasis,"Cuba began to focus on tourism as a vital source of foreign exchange, initiating significant investments in tourism infrastructure to attract international visitors."
Cuba,1991,US Immigration Policy,"The United States implemented a policy allowing Cuban migrants intercepted at sea to be taken to the US, leading to increased attempts by Cubans to reach the US by boat."
Cuba,1991,Pan American Games,"Havana hosted the Pan American Games, showcasing Cuba's commitment to sports and cultural diplomacy despite the economic challenges facing the country."
Cuba,1991,Special Period Deepens,"The economic crisis deepened, with the government officially declaring the start of the ""Special Period in Time of Peace,"" marking a period of severe austerity and hardship."
Cuba,1991,Constitutional Amendments,"Cuba amended its constitution to affirm the socialist nature of its political system, even as it began to introduce limited market-oriented reforms to address the economic crisis."
Cuba,1991,International Solidarity,"Despite economic hardships, Cuba continued to provide international medical assistance, sending doctors and healthcare professionals to countries in need, reinforcing its commitment to international solidarity."
Cuba,1992,US Embargo Tightened,"The United States tightened its embargo on Cuba with the passage of the Cuban Democracy Act, further isolating the island economically and diplomatically."
Cuba,1992,Dollar Legalization,"Cuba legalized the US dollar, allowing it to circulate alongside the Cuban peso, in an effort to stabilize the economy and attract remittances from abroad."
Cuba,1992,Foreign Investment Law,"Cuba passed a foreign investment law to attract foreign capital, marking a significant shift towards opening the economy to international investment."
Cuba,1992,Food Shortages,"Severe food shortages led to the introduction of rationing and the establishment of farmers' markets, where goods could be sold at market prices."
Cuba,1992,Energy Innovation,"In response to fuel shortages, Cuba promoted the use of bicycles and other alternative transportation methods, including the importation of millions of bicycles from China."
Cuba,1993,Self-Employment Legalized,"Cuba legalized self-employment for some professions, marking a shift towards allowing limited private enterprise within the socialist economy."
Cuba,1993,Sugar Harvest Failure,"A significantly failed sugar harvest exacerbated economic woes, highlighting the vulnerability of Cuba's economy to fluctuations in sugar prices and production."
Cuba,1993,Pharmaceutical Advances,"Despite economic hardships, Cuba's biotech and pharmaceutical industries made significant advances, including the development of innovative vaccines and treatments."
Cuba,1993,Housing Reforms,"The government initiated housing reforms, allowing limited private property ownership and sales, in an effort to address housing shortages and stimulate construction."
Cuba,1993,Educational Achievements,"Cuba maintained high educational standards and achievements despite economic challenges, emphasizing the importance of education within the socialist system."
Cuba,1994,Rafters Crisis,"A mass exodus of Cubans on makeshift rafts towards the United States, prompted by economic desperation and seeking asylum, leading to a humanitarian crisis at sea."
Cuba,1994,US-Cuba Migration Agreement,"Following the rafters crisis, Cuba and the United States agreed on a new migration policy to ensure safe, legal, and orderly migration between the two countries."
Cuba,1994,Economic Liberalization Expands,"Cuba expanded economic liberalization measures, including the authorization of more self-employment categories and the opening of farmers' markets for agricultural products."
Cuba,1994,Energy Crisis Innovations,"Continued innovation in response to the energy crisis, including the widespread distribution of pressure cookers and other energy-efficient appliances to households."
Cuba,1994,International Outreach,"Cuba increased its international outreach, strengthening ties with Latin American countries and seeking new trade partners to mitigate the impact of the US embargo."
Cuba,1995,Foreign Investment in Tourism,"Significant foreign investment in the tourism sector, with joint ventures leading to the development of new hotels and resorts aimed at international tourists."
Cuba,1995,Helms-Burton Act,"The United States passed the Helms-Burton Act, further tightening the embargo by penalizing foreign companies doing business in Cuba, leading to international criticism."
Cuba,1995,Sugar Industry Restructuring,"The government began restructuring the sugar industry to improve efficiency and productivity, reflecting the sector's critical importance to the economy."
Cuba,1995,Biotechnology Advances,"Cuba's biotechnology sector continued to advance, with the development and export of medical products and vaccines, contributing to international health initiatives."
Cuba,1995,Cuban Five Arrested,"The arrest of five Cuban intelligence officers in the United States, leading to a high-profile espionage case and exacerbating tensions between Cuba and the US."
Cuba,1996,Pope John Paul II's Visit,"The visit of Pope John Paul II to Cuba, marking a significant moment in Cuba's relations with the Catholic Church and the international community."
Cuba,1996,Economic Reforms Continue,"Continued economic reforms, including the expansion of the private sector and the introduction of tax regulations for self-employed workers."
Cuba,1996,International Relations,"Strengthening of international relations with countries in Latin America, Europe, and Asia, in an effort to counteract the effects of the US embargo."
Cuba,1996,Social Programs Maintained,"Despite economic challenges, Cuba maintained its commitment to social programs, including healthcare and education, showcasing the government's priorities."
Cuba,1996,Energy Sector Developments,"Developments in the energy sector, including efforts to increase energy independence through the development of domestic oil resources and renewable energy projects."
Cuba,1997,Fifth Party Congress,"The Fifth Party Congress of the Communist Party of Cuba, which focused on updating economic and social policies to better address the realities of the post-Soviet world."
Cuba,1997,International Investment,"Continued efforts to attract international investment, particularly in the tourism and mining sectors, to diversify the economy and generate foreign exchange."
Cuba,1997,Hurricane Damage,"Significant damage from hurricanes, prompting national emergency responses and highlighting the challenges of disaster preparedness and recovery in an economically strained context."
Cuba,1997,Educational System Reforms,"Reforms in the educational system to improve efficiency and align educational programs with economic needs, while maintaining high literacy rates and educational achievements."
Cuba,1997,Healthcare Achievements,"Continued achievements in healthcare, including the maintenance of low infant mortality rates and the development of healthcare innovations, despite economic limitations."
Cuba,1998,Papal Visit,"Pope John Paul II visited Cuba, a historic event that highlighted issues of religious freedom, human rights, and the possibility of improved relations between Cuba and the Vatican."
Cuba,1998,Caribbean Solidarity,"Cuba strengthened its solidarity with Caribbean nations, through initiatives such as providing medical assistance and supporting regional integration efforts."
Cuba,1998,Economic Diversification Efforts,"Continued efforts to diversify the economy beyond sugar and tourism, including initiatives in biotechnology, pharmaceuticals, and information technology."
Cuba,1998,Social Security Reforms,Implementation of social security reforms to address the needs of an aging population and ensure the sustainability of pension systems.
Cuba,1998,National Assembly Elections,"National Assembly elections were held, with efforts to demonstrate political participation and consultation within the framework of Cuba's socialist political system."
Cuba,1999,Eli치n Gonz치lez Incident,"The custody battle over Eli치n Gonz치lez, a young Cuban boy found at sea, became a focal point of US-Cuba relations, highlighting issues of migration, family rights, and political ideology."
Cuba,1999,Cultural Diplomacy,"Expansion of cultural diplomacy, including the promotion of Cuban music, art, and dance internationally, as a means of fostering goodwill and cultural exchange."
Cuba,1999,Investment in Infrastructure,"Investment in national infrastructure, including transportation and telecommunications, to support economic development and improve the quality of life."
Cuba,1999,Environmental Initiatives,"Implementation of environmental initiatives to protect Cuba's natural resources, including sustainable agriculture practices and the establishment of protected areas."
Cuba,1999,Latin American Integration,"Active participation in Latin American integration efforts, advocating for regional cooperation and solidarity in facing economic and social challenges."
Cuba,2000,US-Cuba Agricultural Sales,"The United States authorized the sale of agricultural products to Cuba, a significant easing of embargo restrictions, facilitating bilateral trade in essential goods."
Cuba,2000,International Healthcare Contributions,"Cuba's international healthcare contributions expanded, with medical missions providing services in underserved regions globally, enhancing Cuba's international reputation."
Cuba,2000,Battle of Ideas Campaign,"Launch of the ""Battle of Ideas"" campaign, focusing on ideological reinforcement, social programs, and improving access to culture and information for the Cuban population."
Cuba,2000,Energy Crisis Response,"Initiatives to address the energy crisis, including the ""Energy Revolution,"" promoting energy efficiency and the use of renewable energy sources to reduce dependence on imported oil."
Cuba,2000,Advances in Education,"Continued advances in education, with initiatives to improve computer literacy and access to information technology across the educational system."
Cuba,2001,US Trade and Travel Restrictions,"The United States tightened trade and travel restrictions, impacting the Cuban economy and limiting cultural and familial exchanges between the two countries."
Cuba,2001,Social Program Enhancements,"Enhancements to social programs, including healthcare and education, emphasizing the government's commitment to social welfare despite economic pressures."
Cuba,2001,International Solidarity Post-9/11,"Cuba expressed solidarity with the United States following the September 11 attacks, offering medical assistance and condemning terrorism."
Cuba,2001,Economic Strategy Adjustments,"Adjustments to economic strategy, focusing on improving productivity, efficiency, and the gradual introduction of market mechanisms within the socialist framework."
Cuba,2001,Global Anti-Imperialist Initiative,"Promotion of a global anti-imperialist initiative, advocating for a multipolar world and challenging US hegemony in international affairs."
Cuba,2002,US Naval Base Protests,"Protests against the US naval base at Guantanamo Bay, highlighting issues of sovereignty, human rights, and international law."
Cuba,2002,Varela Project,"The Varela Project, a petition for political reform, gained international attention, sparking discussions on political freedoms, human rights, and civil society in Cuba."
Cuba,2002,Export Diversification,"Efforts to diversify exports, focusing on sectors such as biotechnology, pharmaceuticals, and services, to reduce economic vulnerability and increase foreign exchange earnings."
Cuba,2002,International Education Initiatives,"Launch of international education initiatives, including offering scholarships to students from developing countries, as part of Cuba's commitment to international solidarity."
Cuba,2002,Sustainable Development Initiatives,"Implementation of sustainable development initiatives, emphasizing environmental protection, sustainable agriculture, and renewable energy as part of national development strategy."
Cuba,2003,Crackdown on Dissidents,"A government crackdown on dissidents, leading to the arrest and sentencing of numerous activists, journalists, and opposition figures, drawing international criticism for human rights violations."
Cuba,2003,Collaboration with Venezuela,"The initiation of significant collaboration agreements with Venezuela, including oil for doctors program, marking a new era of bilateral relations and mutual support."
Cuba,2003,Cultural Achievements,"Recognition of Cuba's cultural achievements, including film, music, and literature, on the international stage, enhancing Cuba's cultural diplomacy and global presence."
Cuba,2003,National Literacy Campaigns,"National literacy campaigns and educational programs continued, aiming to achieve universal literacy and lifelong learning opportunities for all Cubans."
Cuba,2003,International Sports Achievements,"Cuba's athletes achieved notable successes in international sports competitions, continuing the country's tradition of excellence in sports and contributing to national pride."
Cuba,2004,Economic Reforms,"Introduction of economic measures aimed at stabilizing the economy and encouraging small-scale private business, marking a shift in economic policy towards more market-oriented practices."
Cuba,2004,International Relations,"Strengthening of diplomatic ties with Venezuela, leading to significant economic and political support, including energy agreements and collaborative social programs."
Cuba,2004,Health Initiative,Launch of a comprehensive healthcare program aimed at improving public health outcomes both domestically and internationally through medical diplomacy.
Cuba,2004,Cultural Exchange,"Expansion of cultural exchange programs with countries globally, promoting Cuban art, music, and culture, and enhancing international cultural diplomacy."
Cuba,2004,Hurricane Response,"The island faced a severe hurricane, prompting nationwide emergency response efforts, demonstrating the effectiveness of disaster preparedness and community mobilization."
Cuba,2005,Energy Revolution,"Initiation of the ""Energy Revolution,"" focusing on energy efficiency, renewable energy projects, and reducing dependency on imported fuels."
Cuba,2005,International Summit Hosting,"Hosting of an international summit, highlighting Cuba's role in regional politics and its stance on various global issues, bolstering its international profile."
Cuba,2005,Educational Reforms,"Implementation of educational reforms aimed at improving literacy and educational access, reflecting the government's commitment to education as a priority."
Cuba,2005,Agricultural Initiatives,"Introduction of agricultural initiatives to increase food production and reduce imports, emphasizing sustainable farming practices and food security."
Cuba,2005,Social Program Expansion,"Expansion of social welfare programs, including housing and social security, aimed at improving living standards and reducing inequalities."
Cuba,2006,Leadership Transition,"Temporary transfer of presidential duties due to the health issues of the long-standing leader, marking a significant moment in Cuban political life and sparking discussions about future leadership and reforms."
Cuba,2006,Economic Partnership,"Strengthening of economic partnerships with key allies through trade agreements and joint ventures, aimed at diversifying the economy and reducing economic vulnerabilities."
Cuba,2006,Telecommunications Reform,"Introduction of reforms to improve telecommunications infrastructure, expanding internet access and connectivity in response to increasing demands for digital inclusion."
Cuba,2006,Environmental Policy,"Implementation of comprehensive environmental policies to address climate change, protect biodiversity, and promote sustainable development practices."
Cuba,2006,Public Health Achievement,"Recognition of Cuba's public health achievements, including low infant mortality rates and high life expectancy, showcasing the success of its healthcare system."
Cuba,2007,Energy Sector Development,"Launch of projects aimed at developing the energy sector, including the exploration of oil fields and investment in renewable energy sources to ensure energy security."
Cuba,2007,Social Security Reforms,"Reform of the social security system to ensure its sustainability, including adjustments to retirement age and benefits, reflecting demographic changes and economic challenges."
Cuba,2007,International Medical Assistance,"Deployment of medical brigades to countries in need, highlighting Cuba's commitment to international solidarity and medical diplomacy."
Cuba,2007,National Assembly Elections,"Conducting of National Assembly elections, reinforcing the political process and the role of the assembly in governance and legislative affairs."
Cuba,2007,Urban Renewal Initiatives,Implementation of urban renewal projects aimed at preserving historical heritage while improving infrastructure and housing conditions in urban areas.
Cuba,2008,Formal Leadership Change,"Official election of a new president, marking a historic leadership transition and the beginning of a new era in Cuban politics, with expectations of gradual reforms."
Cuba,2008,Hurricane Recovery Efforts,"Extensive recovery efforts following devastating hurricanes, demonstrating resilience and the capacity for rapid recovery in the face of natural disasters."
Cuba,2008,Agricultural Reform,"Decree to allow the distribution of idle land to farmers to boost agricultural production, addressing food security and reducing import dependency."
Cuba,2008,International Relations Normalization,"Initiatives aimed at normalizing relations with various countries, enhancing Cuba's international engagement and opening up opportunities for cooperation."
Cuba,2008,Economic Diversification Efforts,"Efforts to diversify the economy through the development of biotechnology, tourism, and other sectors, aiming to reduce reliance on traditional exports."
Cuba,2009,US-Cuba Dialogue,"Initiation of dialogue with the United States aimed at easing decades-long tensions, leading to discussions on travel restrictions, remittances, and potential areas of cooperation."
Cuba,2009,Economic Adjustment Policies,"Implementation of economic adjustment policies in response to the global financial crisis, aimed at reducing inefficiencies and stimulating economic growth."
Cuba,2009,Social Media Expansion,"Gradual expansion of social media and internet access, reflecting changing communication landscapes and the desire for increased connectivity."
Cuba,2009,Education System Enhancement,"Efforts to enhance the education system, focusing on technological integration and curriculum development to meet changing societal needs."
Cuba,2009,Renewable Energy Projects,"Initiation of renewable energy projects to harness solar, wind, and bioenergy, contributing to energy sustainability and addressing environmental concerns."
Cuba,2010,Economic Reform Package,"Announcement of a comprehensive package of economic reforms, including the expansion of the private sector, the reduction of state employment, and the encouragement of foreign investment, aiming to modernize the economy."
Cuba,2010,Release of Political Prisoners,"Agreement to release a number of political prisoners, in a move seen as a significant step towards improving human rights and political freedoms."
Cuba,2010,International Healthcare Contribution,"Continued contribution to international healthcare, with Cuban medical personnel providing aid in disaster-struck and developing countries, underscoring Cuba's commitment to global health solidarity."
Cuba,2010,Cultural Diplomacy,"Hosting international cultural festivals and events, strengthening Cuba's cultural diplomacy and showcasing its rich cultural heritage to a global audience."
Cuba,2010,Infrastructure Development,"Launch of significant infrastructure development projects, including the renovation of transportation systems and public buildings, to improve public services and boost tourism."
Cuba,2011,Economic Policy Update,"Updating of economic policies to further integrate market mechanisms into the socialist economy, including allowing for more small business licenses and self-employment opportunities."
Cuba,2011,International Summit Participation,"Active participation in international summits, advocating for global solidarity, sustainable development, and highlighting the impacts of the US embargo on Cuba."
Cuba,2011,Educational Collaboration,"Expansion of international educational collaborations, offering scholarships to foreign students and establishing partnerships with universities worldwide."
Cuba,2011,Environmental Conservation Initiatives,"Launch of initiatives for environmental conservation, emphasizing sustainable agriculture, protection of natural reserves, and climate change mitigation efforts."
Cuba,2011,Technological Advancement,"Introduction of new technologies in various sectors, including biotechnology and medicine, aiming to boost innovation and improve public health outcomes."
Cuba,2012,Economic Liberalization Steps,"Further steps towards economic liberalization, including the expansion of the private sector, and the creation of a wholesale market for private businesses."
Cuba,2012,Travel Policy Reform,"Reform of travel policy, allowing Cubans greater freedom to travel abroad, reflecting a significant easing of restrictions and promoting greater openness."
Cuba,2012,Social Welfare Initiatives,"Introduction of new social welfare initiatives to support the most vulnerable populations, including pension reforms and subsidized housing programs."
Cuba,2012,International Sports Achievements,"Notable achievements in international sports events, enhancing national pride and showcasing Cuban athletes' talents on the world stage."
Cuba,2012,Foreign Investment Law,"Updating of the foreign investment law to attract more foreign direct investment, aiming to stimulate economic growth and development."
Cuba,2013,Port Development Project,"Launch of a major port development project with foreign investment, aiming to boost trade and position Cuba as a key logistical hub in the Caribbean."
Cuba,2013,Internet Access Expansion,"Efforts to expand internet access through the opening of public Wi-Fi hotspots, reflecting a commitment to improving digital connectivity."
Cuba,2013,Renewable Energy Investment,"Increased investment in renewable energy sources, including solar and wind projects, to reduce reliance on imported oil and promote environmental sustainability."
Cuba,2013,Constitutional Reforms,"Initiation of constitutional reform process to reflect economic and social changes, aiming to modernize the legal framework and institutional structures."
Cuba,2013,Cultural Heritage Preservation,"Enhanced efforts in cultural heritage preservation, including restoration of historical sites and promotion of intangible cultural heritage, emphasizing the importance of culture in national identity."
Cuba,2014,Foreign Investment Drive,"A drive to attract more foreign investment, including the creation of a special development zone offering tax and customs benefits to foreign investors."
Cuba,2014,Diplomatic Relations Announcement,"Announcement of efforts to normalize diplomatic relations with a long-standing adversary, marking a historic shift in international relations and opening up new possibilities for cooperation and dialogue."
Cuba,2014,Public Health Milestones,"Achievement of significant public health milestones, recognized internationally for eliminating mother-to-child transmission of certain infectious diseases."
Cuba,2014,Anti-Corruption Measures,"Implementation of anti-corruption measures to address governance and transparency issues, aiming to improve public administration and foster trust in institutions."
Cuba,2014,Urban Agriculture Initiatives,"Promotion of urban agriculture initiatives to enhance food security, encourage sustainable living practices, and support local economies."
Cuba,2015,Embassy Reopening,"Reopening of embassies as part of the normalization of diplomatic relations, facilitating dialogue, cultural exchange, and the easing of some economic restrictions."
Cuba,2015,Economic Zone Expansion,"Expansion of special economic zones to encourage foreign investment in key sectors, aiming to diversify the economy and spur development."
Cuba,2015,Telecommunications Agreement,"Agreement with a foreign company to improve telecommunications infrastructure, marking a significant step towards better internet access and connectivity."
Cuba,2015,International Medical Brigades,"Deployment of medical brigades to fight the Ebola outbreak in West Africa, demonstrating Cuba's commitment to international solidarity in health crises."
