Country,Year,Raw Event,Desc
Czechia,1990,Political Transformation,"Czechoslovakia began its transition from a communist regime to a parliamentary democracy, marked by the first free elections in over 40 years, signaling a significant shift in the political landscape."
Czechia,1990,Economic Reform,"Initiatives for transitioning to a market economy were introduced, including privatization of state-owned enterprises and liberalization of trade, setting the foundation for economic restructuring."
Czechia,1990,Withdrawal of Foreign Troops,"The departure of Soviet troops, stationed in Czechoslovakia since the 1968 invasion, symbolized the end of direct foreign military presence and the country's move towards sovereignty."
Czechia,1990,Restoration of Civil Liberties,"The government undertook steps to restore civil liberties, including freedom of speech, press, and assembly, significantly altering the social and political environment."
Czechia,1990,Revival of Cultural and Political Institutions,"The re-establishment of cultural and political institutions that had been suppressed under communist rule, including political parties and civic organizations, fostering a vibrant public sphere."
Czechia,1991,Economic Transition Challenges,"The country faced challenges associated with the transition to a market economy, including inflation and unemployment, impacting the societal and economic well-being."
Czechia,1991,International Integration Efforts,"Efforts were made to reintegrate Czechoslovakia into the international community, including seeking membership in European and transatlantic political and economic institutions."
Czechia,1991,Legal and Constitutional Reform,"The drafting and adoption of new legal frameworks to support the democratic and market reforms, including efforts towards drafting a new constitution."
Czechia,1991,Decentralization Measures,"Implementation of decentralization measures to transfer powers from the central government to local authorities, aiming to improve governance and public administration."
Czechia,1992,Split of Czechoslovakia,"The formal agreement to dissolve Czechoslovakia into two independent countries, Czechia and Slovakia, effective January 1, 1993, following differences in political and economic visions."
Czechia,1992,Establishment of National Institutions,"Preparation for the establishment of separate Czech institutions, including the national parliament and government agencies, to ensure the smooth transition to independence."
Czechia,1993,Formation of the Czech Republic,"The official establishment of the Czech Republic on January 1, marking the successful peaceful division of Czechoslovakia and the beginning of a new chapter in national history."
Czechia,1993,Economic Stabilization Measures,"Implementation of economic stabilization measures to address inflation and promote growth in the newly independent Czech Republic, focusing on creating a stable environment for investment."
Czechia,1993,Security and Defense Policy,"The establishment of independent security and defense policies, including the formation of the Czech military forces and strategies for national defense."
Czechia,1994,Privatization and Economic Growth,"Continued privatization of state-owned enterprises and promotion of private investment, contributing to significant economic growth and development."
Czechia,1994,Infrastructure Development,"Major investments in infrastructure, including transportation and telecommunications, to support economic development and integration into European networks."
Czechia,1995,Integration into European Institutions,"Active efforts to integrate into European political and economic institutions, including applying for membership in the European Union, signaling the country's Western orientation."
Czechia,1995,Social Policy Reforms,"Reforms in social policies to address issues related to health care, education, and social security, aiming to improve the quality of life and social welfare."
Czechia,1995,Cultural Renaissance,"A renaissance of Czech culture, including the revival of traditional festivals, literature, and arts, fostering national identity and international cultural exchange."
Czechia,1996,Parliamentary Elections,"Elections were held, leading to a coalition government. This period marked political stabilization and efforts towards economic reforms in the post-communist era."
Czechia,1996,Floods,"Severe flooding occurred, impacting various regions, causing significant damage to infrastructure and homes, and leading to a nationwide response to aid affected areas."
Czechia,1996,Economic Reforms,"The government initiated a series of economic reforms aimed at privatization and market liberalization, seeking to transition to a fully market-driven economy."
Czechia,1996,NATO Aspiration,"The country formally expressed its desire to join NATO, marking a significant shift in foreign policy and military alignment post-Cold War."
Czechia,1996,Cultural Heritage Recognition,"Several sites were designated as UNESCO World Heritage Sites, highlighting the country's rich cultural heritage and historical significance on the global stage."
Czechia,1997,Government Crisis,"A political crisis led to the resignation of key government officials, impacting the political landscape and prompting early elections."
Czechia,1997,Economic Recession,"The country entered a recession, marked by high inflation and unemployment, leading to widespread economic adjustments and policy shifts."
Czechia,1997,Floods Again,"Another year of severe flooding, worse than the previous instances, causing extensive damage and highlighting the need for improved environmental and infrastructure planning."
Czechia,1997,International Relations,Strengthened international relations through active participation in global organizations and efforts to secure closer ties with Western European countries.
Czechia,1997,Bank Reforms,"The government implemented significant reforms in the banking sector to stabilize the economy, improve transparency, and attract foreign investment."
Czechia,1998,Parliamentary Elections,"Another round of parliamentary elections, reflecting the ongoing political evolution and the electorate's response to economic conditions and governance issues."
Czechia,1998,Economic Stabilization,"Initiatives were launched to stabilize the economy, including measures to curb inflation, improve fiscal discipline, and foster growth."
Czechia,1998,Educational Reforms,"Major reforms in the education sector were initiated, aiming at modernizing curricula, improving access to education, and enhancing the quality of higher education."
Czechia,1998,Infrastructure Development,"Significant investment in infrastructure, including transportation and telecommunications, to support economic growth and integrate with European networks."
Czechia,1998,Environmental Legislation,"New environmental laws were enacted to address pollution, protect natural resources, and meet international environmental standards."
Czechia,1999,NATO Membership,"The country officially became a member of NATO, marking a significant milestone in its post-Cold War foreign policy and security alignment."
Czechia,1999,Economic Growth,"After a period of recession, the economy showed signs of recovery, with growth in GDP and improvements in the investment climate."
Czechia,1999,Technological Advancement,"Advances in technology and telecommunications, including the expansion of internet access, contributing to the country's modernization and global connectivity."
Czechia,1999,Social Reforms,"Introduction of social reforms aimed at improving healthcare, social security, and welfare systems to address societal needs and disparities."
Czechia,1999,Cultural Initiatives,"Launch of initiatives to promote Czech culture and heritage both nationally and internationally, including festivals, exhibitions, and cultural exchange programs."
Czechia,2000,Presidential Election,"The election of a new president through a parliamentary vote, reflecting the country's democratic processes and political stability."
Czechia,2000,Economic Integration,"Steps were taken towards further economic integration with the European Union, preparing the ground for eventual EU membership."
Czechia,2000,Environmental Policy,"Implementation of comprehensive environmental policies aimed at sustainability, conservation, and aligning with EU environmental standards."
Czechia,2000,Science and Research Investment,"Increased investment in science and research, focusing on technological innovation, research infrastructure, and collaboration with international institutions."
Czechia,2000,Health Care Reform,"Reform of the healthcare system to improve efficiency, accessibility, and quality of care, responding to the challenges of modern healthcare needs."
Czechia,2001,Political Leadership Change,"A significant shift in the country's political landscape occurred following parliamentary elections, resulting in a new coalition government aimed at addressing economic reforms and EU integration."
Czechia,2001,Floods,"Severe flooding affected large parts of the country, causing substantial damage to infrastructure and homes, leading to nationwide efforts in disaster response and recovery."
Czechia,2001,NATO Summit,"The country hosted a major international summit for a military alliance, emphasizing its strategic role in international security and its commitment to collective defense."
Czechia,2001,Economic Reforms,"The government implemented significant economic reforms focusing on privatization and market liberalization, aiming to improve the economic environment and attract foreign investment."
Czechia,2001,Cultural Heritage Recognition,"Several sites within the country were designated as World Heritage Sites, highlighting the global significance of its cultural and historical heritage."
Czechia,2002,EU Accession Negotiations,"The country successfully concluded negotiations for accession to the European Union, marking a pivotal step towards integration into the European community."
Czechia,2002,Major Floods,"Another year of catastrophic flooding, particularly affecting the capital city, prompting widespread emergency responses, and leading to discussions on climate change and flood prevention."
Czechia,2002,International Film Festival,"The country's renowned international film festival gained increased global recognition, showcasing its cultural influence and attracting international visitors."
Czechia,2002,Public Health Initiative,Launch of significant public health initiatives aimed at modernizing healthcare infrastructure and improving health services for the population.
Czechia,2002,Telecommunications Expansion,"Rapid expansion of telecommunications infrastructure, including internet and mobile services, enhancing connectivity and technological advancement."
Czechia,2003,Joining the European Union,"The country officially joined the European Union, marking a historic moment of integration into European political and economic structures."
Czechia,2003,Currency Reform,"Implementation of significant reforms to the national currency system, aimed at stabilizing the economy and preparing for future integration into the Eurozone."
Czechia,2003,Science and Research Funding,"Increased investment in science and research, highlighting a commitment to technological innovation and knowledge-based economy."
Czechia,2003,Environmental Legislation,"Adoption of comprehensive environmental legislation, aiming to address pollution, protect natural resources, and meet European environmental standards."
Czechia,2003,Education Reform,"Major reforms in the education system were introduced, focusing on higher education accessibility, quality improvement, and alignment with European standards."
Czechia,2004,NATO Expansion Role,"The country played a significant role in the expansion of a military alliance, underscoring its strategic importance and commitment to regional security."
Czechia,2004,Infrastructure Modernization,"Launch of major infrastructure projects, including transport and energy networks, to modernize the country's infrastructure and enhance economic growth."
Czechia,2004,Tourism Milestone,"Record numbers of tourists visited, driven by the country's rich cultural heritage and historic cities, contributing significantly to the economy."
Czechia,2004,Pension System Reform,"The government introduced reforms to the pension system, aiming to ensure long-term sustainability and address demographic changes."
Czechia,2004,International Cooperation Agreement,"The country signed several international cooperation agreements, enhancing its diplomatic relations and global partnerships."
Czechia,2005,Presidential Election,"A significant presidential election took place, reflecting the country's democratic processes and the role of the presidency in Czech politics."
Czechia,2005,Public Finance Reform,"Implementation of comprehensive reforms aimed at improving public finance management, fiscal responsibility, and budget transparency."
Czechia,2005,Energy Policy Shift,"Introduction of new energy policies focusing on renewable energy sources and energy efficiency, reflecting a commitment to sustainability and energy independence."
Czechia,2005,Labor Market Reforms,"Reforms in the labor market were introduced to increase flexibility, competitiveness, and address unemployment issues."
Czechia,2005,High-Speed Rail Project,"Announcement of plans to develop a high-speed rail network, aiming to enhance connectivity and mobility within the country and with neighboring European countries."
Czechia,2006,Parliamentary Elections,"Elections resulted in a hung parliament, leading to a protracted period of political negotiations and the formation of a new government, highlighting the country's fragmented political landscape."
Czechia,2006,Economic Growth,"The country experienced significant economic growth, one of the highest rates in its history, driven by increased foreign investment, exports, and consumer spending, showcasing the strength of its post-communist economy."
Czechia,2006,Major Infrastructure Projects,"Initiation of several large-scale infrastructure projects, including highway and railway expansions, aimed at improving national and cross-border transportation, reflecting the government's focus on enhancing mobility and economic efficiency."
Czechia,2007,Schengen Area Entry,"The country joined the Schengen Area, allowing for passport-free travel across European borders, signifying a major step in its integration into European structures and facilitating easier movement for its citizens."
Czechia,2007,Environmental Initiatives,"Launch of ambitious environmental initiatives focusing on renewable energy and conservation, reflecting a growing national commitment to sustainable development and addressing global climate change."
Czechia,2008,Global Financial Crisis Impact,"The global financial crisis affected the Czech economy, leading to a slowdown in growth, increased unemployment, and fiscal challenges, prompting government responses to stabilize the economy and protect vulnerable sectors."
Czechia,2008,Anti-corruption Measures,"Introduction of significant anti-corruption measures and legislation, aimed at combating corruption within public services and politics, highlighting the government's commitment to transparency and good governance."
Czechia,2009,Presidency of the Council of the European Union,"The country held the Presidency of the Council of the European Union, playing a crucial role in addressing European and global challenges, enhancing its position on the international stage."
Czechia,2009,Healthcare Reform,"Implementation of healthcare reform aimed at improving the efficiency, accessibility, and quality of healthcare services, reflecting ongoing debates about the best approaches to public health in a changing society."
Czechia,2009,Cultural Recognition,"Czechia's cultural heritage received significant recognition, with additional sites added to UNESCO's World Heritage List, underscoring the country's rich history and commitment to preserving its cultural legacy."
Czechia,2010,Presidential Election,A controversial presidential election process highlighted the political divisions within the country and the debate over the direct election of the president versus parliamentary selection.
Czechia,2010,Floods,"Severe flooding affected large parts of the country, causing widespread damage to homes and infrastructure, leading to national emergency responses and debates over climate change impacts and preparedness."
Czechia,2010,Education Reform,"Launch of education reform initiatives aimed at improving the quality and international competitiveness of Czech education, including higher education and research sectors."
Czechia,2010,Public Demonstrations,"Large public demonstrations over economic and social issues, reflecting public discontent with government policies, austerity measures, and social inequality."
Czechia,2010,Technological Advancement,"Significant advancements in technology sectors, including IT and engineering, positioning Czechia as a growing center for innovation and technological development in Central Europe."
Czechia,2011,Presidential Election,"The country held a presidential election, marking a significant moment in its political landscape with the election of a new head of state, highlighting the democratic process and its impact on the nation's direction."
Czechia,2011,Economic Measures,"The government implemented austerity measures in response to the global financial crisis, aiming to reduce the national deficit and stabilize the economy, leading to public debates on economic policies and social impact."
Czechia,2011,Educational Reform,"Introduction of major reforms in the education system to improve quality and efficiency, sparking discussions on educational standards, teacher evaluations, and student outcomes."
Czechia,2011,Environmental Legislation,"New environmental legislation was passed to address pollution and promote sustainable development, reflecting the country's commitment to environmental protection and compliance with European Union standards."
Czechia,2011,Public Protests,"Large-scale public protests occurred against government policies and corruption, demonstrating the civic engagement and demand for transparency and accountability in governance."
Czechia,2012,Political Corruption Scandal,"A significant political corruption scandal unfolded, involving high-ranking officials, which led to resignations and a national conversation about corruption, governance, and the rule of law."
Czechia,2012,Health Care Reform,"The government proposed health care reforms to address system inefficiencies and funding, sparking debates on health care accessibility, quality, and the future of public health services."
Czechia,2012,Technological Advancement,"Significant advancements in technology sectors, promoting the country's innovation landscape, including the expansion of tech startups and investment in research and development."
Czechia,2012,Infrastructure Development,"Major infrastructure projects were announced or initiated, aiming to improve transportation, urban development, and regional connectivity, impacting economic growth and quality of life."
Czechia,2012,International Sports Achievement,"Athletes from Czechia achieved notable success in international sports competitions, enhancing the country's reputation on the global stage and promoting national pride."
Czechia,2013,Flooding,"Severe flooding affected large areas, causing significant damage to homes, infrastructure, and the economy, leading to national emergency responses and discussions on climate change and flood prevention."
Czechia,2013,Energy Policy,"The government announced changes to energy policy focusing on renewable sources and energy independence, reflecting shifts in global energy trends and environmental concerns."
Czechia,2013,Cultural Heritage,"Recognition of significant cultural and historical sites, underscoring the importance of preserving national heritage and promoting tourism and cultural identity."
Czechia,2013,Foreign Relations Initiative,"New initiatives were undertaken to strengthen foreign relations, focusing on trade, security, and cultural exchanges, aiming to enhance Czechia's position in the international community."
Czechia,2013,Public Health Campaign,"Launch of a public health campaign addressing lifestyle diseases, emphasizing preventive measures and healthy living, highlighting the government's focus on public health and wellness."
Czechia,2014,Economic Growth,"The country experienced economic growth, marked by increased investment, improved job market, and rising consumer confidence, reflecting recovery from previous economic challenges."
Czechia,2014,Legislative Changes,"Significant legislative changes were made to improve the business environment and regulatory framework, aiming to boost entrepreneurship, innovation, and economic competitiveness."
Czechia,2014,Environmental Campaign,"A nationwide environmental campaign was launched to promote recycling, conservation, and sustainable practices, demonstrating a commitment to environmental stewardship."
Czechia,2014,Cybersecurity Initiative,"Introduction of a national cybersecurity initiative to protect against cyber threats, enhancing national security and the protection of digital infrastructure."
Czechia,2014,Educational Innovation,"Introduction of innovative educational programs focusing on science, technology, engineering, and mathematics (STEM), aiming to prepare students for the demands of the modern workforce."
Czechia,2015,Political Leadership Change,"A change in political leadership following national elections, impacting the country's policy direction and governance, and reflecting the democratic process."
Czechia,2015,Migration Crisis Response,"The country's response to the European migration crisis, involving debates on immigration policy, humanitarian aid, and border security, reflecting broader European challenges."
Czechia,2015,Cultural Festival Expansion,"The expansion of cultural festivals celebrating Czech heritage, arts, and literature, promoting cultural identity and attracting international visitors."
Czechia,2015,Innovation Hub Development,"Efforts to develop Czechia as a regional innovation hub, including support for startups, research and development incentives, and collaboration with international tech companies."
Czechia,2015,International Agreement Participation,"Participation in significant international agreements focusing on climate change and sustainable development, underscoring Czechia's commitment to global environmental goals."
Czechia,2016,Government Reshuffle,"A significant change in the government's composition, aiming to address political challenges and public demands for reform."
Czechia,2016,Economic Growth,"The country experienced notable economic growth, driven by increased industrial production, exports, and consumer demand."
Czechia,2016,Public Protests,"Large-scale public demonstrations occurred, focusing on various social and political issues, including government policies and corruption."
Czechia,2016,Environmental Initiatives,Introduction of significant environmental initiatives aimed at reducing pollution and promoting sustainability within the country.
Czechia,2016,Cultural Milestone,"A major anniversary of a historic cultural event was celebrated, highlighting Czechia's rich history and heritage."
Czechia,2017,Presidential Election,"A presidential election took place, reflecting the country's democratic processes and the public's involvement in choosing their head of state."
Czechia,2017,Technological Advancement,"Significant advancements in technology sectors, positioning Czechia as a growing hub for innovation and development in Central Europe."
Czechia,2017,Infrastructure Development,"Major investments in infrastructure, including transportation and urban development projects, aimed at improving quality of life and economic efficiency."
Czechia,2017,Educational Reform,Implementation of educational reforms to enhance the quality and accessibility of education across the country.
Czechia,2017,International Sporting Event,"Czechia hosted an international sporting event, showcasing its capabilities and enhancing its international reputation."
Czechia,2018,Legislative Changes,"The government enacted important legislative changes, impacting areas such as business, healthcare, and social policy."
Czechia,2018,Cybersecurity Incident,"A significant cybersecurity incident affected institutions, highlighting the importance of digital security and resilience."
Czechia,2018,Historical Commemoration,"The country commemorated a significant historical event, promoting national unity and historical awareness."
Czechia,2018,Environmental Policy,"Introduction of new environmental policies aimed at conservation and sustainability, reflecting Czechia's commitment to environmental issues."
Czechia,2018,Cultural Festival,"A major cultural festival attracted international attention, celebrating Czechia's cultural diversity and heritage."
Czechia,2019,Political Demonstrations,"Large political demonstrations were held, with citizens expressing views on government actions and policies."
Czechia,2019,Health Initiative Launch,Launch of significant health initiatives aimed at improving public health and addressing specific health challenges.
Czechia,2019,International Relations,"Czechia engaged in notable international relations efforts, strengthening ties with other countries and participating in international dialogues."
Czechia,2019,Scientific Achievement,"Czech scientists contributed to a major scientific achievement, gaining international recognition for their work."
