Country,Year,Raw Event,Desc
Czechia,2019,Tourism Milestone,"A record number of tourists visited Czechia, highlighting its appeal as a major European destination."
Czechia,2020,COVID-19 Pandemic Response,"Czechia, like the rest of the world, faced the COVID-19 pandemic, implementing measures to protect public health and mitigate the impact on society and the economy."
Czechia,2020,Economic Support Measures,"In response to the pandemic, the government introduced economic support measures to aid businesses and individuals affected by lockdowns and restrictions."
Czechia,2020,Educational Adjustments,"The pandemic led to adjustments in the educational system, including the implementation of remote learning and changes to examination protocols."
Czechia,2020,Public Health Campaigns,"Launch of public health campaigns to address the pandemic, focusing on prevention, vaccination, and public awareness."
Czechia,2020,Community Solidarity,"The pandemic saw remarkable acts of community solidarity and volunteerism, with citizens and organizations coming together to support healthcare workers and those in need."
Czechia,2021,Pandemic Management,"The country faced significant challenges in managing the COVID-19 pandemic, including high infection rates, leading to strict lockdown measures, a state of emergency, and an accelerated vaccination campaign."
Czechia,2021,Political Change,"Elections held in the country led to a significant shift in the political landscape, with a new coalition government formed, promising changes in policy direction, governance, and international relations."
Czechia,2021,Energy Policy Shift,"The government announced plans to phase out coal by a certain year and increase the reliance on nuclear and renewable energy sources, reflecting a significant shift in national energy policy towards sustainability."
Czechia,2021,Educational Reform,"The introduction of reforms aimed at enhancing digital education and adapting the curriculum to better prepare students for a rapidly changing global landscape, reflecting a shift towards modernizing the education system."
Czechia,2021,Flood Management Initiatives,"The country implemented significant flood management and prevention measures in response to past flooding events, aiming to protect communities and infrastructure from future natural disasters."
Czechia,2022,Infrastructure Development,"Major investments were announced in infrastructure, including transport and digital networks, aimed at boosting economic growth and connectivity within the country and with the European Union."
Czechia,2022,Healthcare System Overhaul,"The government launched initiatives to overhaul the healthcare system, focusing on improving hospital infrastructure, increasing healthcare workers' wages, and enhancing patient care services."
Czechia,2022,Environmental Conservation,"Significant steps were taken towards environmental conservation, including the expansion of protected areas, initiatives to reduce carbon emissions, and the promotion of biodiversity."
Czechia,2022,Technological Innovation,"The country made substantial investments in technological innovation, including support for startups, research and development in AI and robotics, aiming to position itself as a leader in technology within the European Union."
Czechia,2022,Social Policy Reforms,"The introduction of social policy reforms aimed at improving social equity, including measures to support families, increase pensions, and address poverty and homelessness."
Czechia,2023,Economic Recovery Plan,"The government announced a comprehensive economic recovery plan to address the aftermath of the pandemic, focusing on job creation, supporting small and medium-sized enterprises, and stimulating investment."
Czechia,2023,Education and Research Funding,"Increased funding for education and research sectors to boost innovation and competitiveness, including significant investments in science, technology, engineering, and mathematics (STEM) fields."
Czechia,2023,Cybersecurity Strategy,"Implementation of a national cybersecurity strategy to protect critical infrastructure and address the growing threat of cyber attacks, reflecting the importance of cybersecurity in national security."
Czechia,2023,Cultural Heritage Preservation,"Launch of initiatives aimed at preserving and promoting Czech cultural heritage, including the renovation of historical sites, museums, and the promotion of Czech arts and literature on the international stage."
Czechia,2023,International Relations and Diplomacy,"Active engagement in international relations and diplomacy, including efforts to strengthen ties with European neighbors and key global partners, reflecting a strategic approach to foreign policy and international cooperation."
