Country,Year,Raw Event,Desc
Egypt,2010,Innovation and Technology Promotion,"National initiatives to promote innovation and technology, including support for startups, research and development, and digital transformation, were launched, aiming at economic modernization and competitiveness."
Egypt,2011,Political Revolution,"A popular revolution led to the ousting of the long-standing president, marking a significant shift in the political landscape, sparking nationwide protests demanding political change, freedom, and social justice."
Egypt,2011,Transitional Government Formation,"A transitional government was formed to manage the post-revolution period, focusing on restoring stability, organizing elections, and drafting a new constitution, impacting governance and democratic processes."
Egypt,2011,Economic Challenges and Aid Initiatives,"The post-revolution period saw economic challenges, including declines in tourism and foreign investment, prompting the implementation of aid initiatives and economic stabilization measures to address fiscal deficits and support economic recovery."
Egypt,2011,Protests,"Mass protests erupt across Egypt, demanding the resignation of the president and political reforms."
Egypt,2011,Revolution,"A popular uprising culminates in the ousting of the president, marking the end of his regime."
Egypt,2011,Government Overthrow,The Egyptian military seizes control of the government following weeks of protests and instability.
Egypt,2011,Transition of Power,"The president resigns amid mass demonstrations, leading to a transitional period of political uncertainty."
Egypt,2011,Political Unrest,Political turmoil ensues as the government struggles to maintain control amidst widespread protests and demands for change.
Egypt,2012,Presidential Election,"Egypt holds its first democratic presidential election, marking a significant step in its political transition."
Egypt,2012,Islamist Victory,"An Islamist candidate wins the presidential election, signaling a shift in Egypt's political landscape."
Egypt,2012,Constitutional Crisis,"Controversy erupts over the drafting of a new constitution, fueling tensions between secular and religious factions."
Egypt,2012,Protests,"Mass protests erupt against the government, accusing it of authoritarianism and undermining democratic principles."
Egypt,2012,Clashes,"Violent clashes erupt between supporters and opponents of the government, leading to casualties and heightened instability."
Egypt,2012,Political Transition,"The country saw its first democratic presidential election, marking a significant milestone after the uprising that ended a long-standing leadership, highlighting the move towards democratic governance."
Egypt,2012,Constitutional Referendum,"A controversial referendum on a new constitution sparked nationwide debates on governance, human rights, and the future direction of the country, reflecting deep political and societal divisions."
Egypt,2012,Economic Challenges,"The nation faced significant economic difficulties, including currency devaluation and subsidy cuts, leading to public discontent and impacting daily life across the country."
Egypt,2013,Political Unrest,"Massive protests against the president culminated in his ouster by the military, marking a pivotal moment in the country's political landscape and leading to a period of instability and governance transition."
Egypt,2013,Violent Clashes,"The dispersal of sit-ins protesting the ouster of the president led to significant loss of life, international condemnation, and a deepening of national divisions."
Egypt,2013,State of Emergency,"A state of emergency was declared in response to escalating violence, involving curfews and a significant military presence in key cities, aiming to restore order but also raising human rights concerns."
Egypt,2013,Military Intervention,"The military ousts the president following mass protests against his rule, sparking political upheaval."
Egypt,2013,Crackdown,"Security forces crack down on supporters of the ousted president, resulting in widespread violence and human rights abuses."
Egypt,2013,State of Emergency,The government declares a state of emergency amid escalating violence and civil unrest.
Egypt,2013,Massacre,"Security forces clash with protesters, resulting in a massacre that draws international condemnation."
Egypt,2013,Political Polarization,Egypt becomes increasingly polarized between supporters and opponents of the military-backed government.
Egypt,2014,Presidential Election,"Egypt holds presidential elections, resulting in the election of a former military chief as president."
Egypt,2014,Terrorism,"The country faces a surge in terrorist attacks, targeting security forces and civilian populations."
Egypt,2014,Political Repression,"The government cracks down on dissent, arresting activists and imposing restrictions on civil liberties."
Egypt,2014,Unrest,Unrest simmers as economic challenges persist and dissatisfaction with the government grows.
Egypt,2014,Regional Conflict,"Egypt becomes embroiled in regional conflicts, particularly in neighboring Libya and Gaza."
Egypt,2014,New Constitution Adoption,"A referendum approved a new constitution, aiming to establish a framework for democratic governance and the rule of law, amidst debates on political inclusion and freedoms."
Egypt,2014,Presidential Election,"A former military officer was elected president, consolidating power and initiating a period of political stabilization, though accompanied by criticisms of electoral fairness and political freedoms."
Egypt,2014,Economic Reforms,"The government launched a series of economic reforms, including subsidy cuts and tax changes, aimed at stabilizing the economy and securing international loans, despite causing public concern over rising living costs."
Egypt,2015,Terrorism,"A significant terrorist attack targeted security forces in the Sinai Peninsula, highlighting ongoing security challenges and the government's efforts to combat extremism."
Egypt,2015,Suez Canal Expansion,"The completion of a major expansion of the Suez Canal was heralded as a landmark achievement, aimed at boosting the country's strategic importance and economic revenues."
Egypt,2015,Parliamentary Elections,"Elections were held to form a new parliament, seen as a key step in the political roadmap towards democracy, though faced with challenges related to participation and representation."
Egypt,2015,Economic Crisis,"Egypt grapples with a worsening economic crisis, marked by inflation, unemployment, and austerity measures."
Egypt,2015,Infrastructure Development,The government launches ambitious infrastructure projects aimed at stimulating economic growth and development.
Egypt,2015,Social Unrest,"Protests erupt over economic grievances, including high prices and low wages, posing challenges to the government."
Egypt,2015,Terrorist Attacks,"The country continues to face terrorist attacks, particularly targeting security forces and tourist sites."
Egypt,2015,International Relations,Egypt's foreign relations face scrutiny amid concerns over human rights abuses and political instability.
Egypt,2016,Economic Reforms,"The government implements economic reforms, including subsidy cuts and currency devaluation, to address fiscal challenges."
Egypt,2016,Militant Insurgency,"Militant groups intensify their insurgency against the government, posing security threats across the country."
Egypt,2016,Political Stability,"The government seeks to maintain stability amidst ongoing challenges, including economic turmoil and security threats."
Egypt,2016,Regional Diplomacy,"Egypt plays a key role in regional diplomacy, particularly in efforts to mediate conflicts in the Middle East."
Egypt,2016,Human Rights Concerns,"Egypt faces criticism over human rights abuses, including crackdowns on dissent and media censorship."
Egypt,2016,Currency Floatation,"The decision to float the currency in line with IMF loan agreements led to a sharp devaluation, affecting prices and living standards, but seen as crucial for economic reform."
Egypt,2016,Church Bombings,"A series of bombings targeted churches, exacerbating sectarian tensions and prompting national and international concerns over religious freedom and security."
Egypt,2016,IMF Loan Agreement,"Egypt secured a significant loan from the International Monetary Fund, committing to comprehensive economic reforms, including subsidy cuts and tax increases, aimed at addressing fiscal imbalances and promoting growth."
Egypt,2017,Terrorist Attacks,"Multiple terrorist attacks targeted security personnel and religious sites, underlining the ongoing security challenges and the impact on social cohesion and tourism."
Egypt,2017,Economic Measures,"Further economic reforms were implemented, including subsidy reductions and tax adjustments, as part of commitments to international financial institutions, leading to debates on economic policy and social equity."
Egypt,2017,Presidential Election,"The president was re-elected in a vote that highlighted the political landscape's stability and challenges, amidst discussions on political diversity and electoral integrity."
Egypt,2017,Social Reforms,The government announces social welfare reforms aimed at addressing public grievances and reducing poverty.
Egypt,2017,Counterterrorism Efforts,"Egypt intensifies its efforts to combat terrorism, launching military operations against extremist groups."
Egypt,2017,Civil Society Crackdown,"The government tightens restrictions on civil society organizations, stifling dissent and activism."
Egypt,2018,Security Crackdown,"Security forces crackdown on dissent, arresting activists and journalists, and limiting freedom of expression."
Egypt,2018,Economic Growth,"Egypt experiences modest economic growth, buoyed by reforms and investment in infrastructure projects."
Egypt,2018,Regional Influence,Egypt asserts its regional influence through diplomatic efforts and participation in conflict mediation.
Egypt,2018,Water Dispute,"Egypt faces tensions with upstream countries over water resources, particularly regarding the Nile River."
Egypt,2018,Anti-Terrorism Operations,"The government launched comprehensive military operations against terrorist groups in the Sinai Peninsula, aiming to restore security and stability in the region."
Egypt,2018,Economic Development Projects,"The inauguration of new mega-projects, including new cities and infrastructure developments, aimed at stimulating economic growth and addressing urban challenges."
Egypt,2018,Social Reforms,"Initiatives to empower women and improve social welfare were announced, reflecting efforts to address societal issues and promote inclusivity."
Egypt,2019,Constitutional Amendments,"Amendments extending presidential terms and enhancing presidential powers were approved in a referendum, sparking debates on governance, democracy, and the concentration of power."
Egypt,2019,Grand Ethiopian Renaissance Dam Negotiations,Ongoing negotiations over the dam's impact on the Nile's water resources highlighted regional water security challenges and diplomatic efforts to reach an agreement.
Egypt,2019,Discovery of Archaeological Sites,"The discovery of significant archaeological sites attracted global attention, underscoring the country's rich cultural heritage and its importance for tourism and national identity."
Egypt,2019,Political Dissent,"Dissent against the government grows, fueled by concerns over human rights abuses and lack of political freedoms."
Egypt,2019,Economic Downturn,"Egypt's economy faces challenges, including currency devaluation and rising unemployment, impacting citizens' livelihoods."
Egypt,2019,Social Unrest,"Protests erupt over economic hardships and government policies, reflecting widespread discontent among the population."
Egypt,2019,International Relations,"Egypt navigates complex international relations, balancing alliances with regional and global powers."
Egypt,2019,Development Projects,"The government continues to prioritize infrastructure development projects, aiming to spur economic growth."
Egypt,2020,COVID-19 Pandemic Response,"The outbreak of the COVID-19 pandemic led to health and economic challenges, prompting government measures to contain the virus and mitigate its impact on society and the economy."
Egypt,2020,Green Economy Initiatives,"The launch of initiatives aimed at promoting renewable energy and sustainable practices, reflecting a commitment to environmental sustainability and climate action."
Egypt,2020,Regional Diplomacy,"Active engagement in regional diplomacy and conflict mediation, aiming to stabilize the region and assert the country's role as a key regional actor."
Egypt,2020,Economic Recession,"The pandemic exacerbates Egypt's economic challenges, leading to a recession and exacerbating poverty rates."
Egypt,2020,Political Controversy,"Controversy surrounds the government's handling of the pandemic, with criticism over transparency and accountability."
Egypt,2020,Social Unrest,"Lockdown measures and economic hardships spark protests across the country, challenging government stability."
Egypt,2020,Regional Conflicts,"Egypt continues to be involved in regional conflicts, particularly in Libya and the Eastern Mediterranean."
Egypt,2021,Presidential Election,"Egypt holds presidential elections, resulting in the re-election of the incumbent amid allegations of electoral fraud."
Egypt,2021,Economic Recovery,"Egypt implements measures to revive its economy post-pandemic, focusing on recovery and stimulus packages."
Egypt,2021,Social Media Regulation,"The government tightens regulations on social media, raising concerns about freedom of expression and censorship."
Egypt,2021,Climate Change,"Egypt faces increasing challenges from climate change, including water scarcity and extreme weather events."
Egypt,2021,Suez Canal Blockage,"A major global shipping route was blocked by a grounded container ship, causing significant disruption to global trade and highlighting the canal's strategic importance."
Egypt,2021,Human Rights Initiatives,"The government announced initiatives to address human rights concerns, aiming to improve the legal and social environment, amidst international scrutiny and calls for reforms."
Egypt,2021,Economic Recovery Efforts,"Efforts to recover from the pandemic's economic impact, including stimulus measures and initiatives to boost tourism and foreign investment, amidst ongoing economic reforms."
Egypt,2022,Climate Summit Hosting,"Hosting a major international climate summit, emphasizing the country's commitment to addressing global climate challenges and promoting environmental sustainability."
Egypt,2022,Infrastructure Development,"Continued expansion of infrastructure and urban development projects, including transportation networks and new cities, aiming to drive economic growth and improve living standards."
Egypt,2022,Water Resource Management,"Initiatives to address water scarcity and enhance water resource management, reflecting the critical importance of water security for the country's future."
Egypt,2022,Political Crackdown,"The government intensifies its crackdown on political opposition and dissent, further restricting civil liberties."
Egypt,2022,Economic Reforms,Egypt implements economic reforms aimed at attracting foreign investment and stimulating growth.
Egypt,2022,Regional Stability,"Egypt plays a key role in regional stability efforts, particularly in mediating conflicts in the Middle East."
Egypt,2022,Technological Advancements,Egypt invests in technological advancements and innovation to drive economic development.
Egypt,2022,Environmental Conservation,"The government launches initiatives to address environmental challenges, including pollution and conservation efforts."
Egypt,2023,Legislative Elections,"Egypt holds legislative elections, resulting in a victory for the ruling party amid allegations of electoral irregularities."
Egypt,2023,Economic Challenges,"Egypt faces economic challenges, including inflation and unemployment, despite reform efforts."
Egypt,2023,Social Reform,The government announces social reform initiatives aimed at addressing poverty and improving living standards.
Egypt,2023,Security Threats,"Egypt grapples with security threats from militant groups and domestic instability, impacting stability."
Egypt,2023,International Relations,"Egypt navigates complex international relations, balancing alliances and strategic partnerships."
Egypt,2023,Economic Policy Adjustments,"Implementation of new economic policies aimed at addressing inflation and improving fiscal stability, in response to global economic pressures and domestic challenges."
Egypt,2023,Technological Innovation,"Emphasis on technological innovation and digital transformation, aiming to modernize the economy, enhance public services, and promote tech-driven growth."
Egypt,2023,Cultural Heritage Preservation,"Efforts to preserve and promote cultural heritage, including restoration projects and international exhibitions, highlighting the country's historical significance and contribution to world heritage."
