Country,Year,Raw Event,Desc
Egypt,1990,Economic Reform Measures,"The government implemented significant economic reforms and liberalization measures, aimed at stabilizing the economy and encouraging foreign investment, impacting various sectors and the general population."
Egypt,1990,Regional Conflict Participation,"Egypt played a key role in a coalition of countries responding to an invasion in the Middle East, contributing military forces and influencing regional dynamics."
Egypt,1990,Uprising,"Anti-government protests erupted in major cities, demanding political reforms and economic improvements."
Egypt,1990,Political Assassination,"Assassination of a prominent politician, sparking tensions and concerns over political instability."
Egypt,1990,Labor Strikes,"Nationwide strikes by workers demanding better wages and working conditions, disrupting various industries."
Egypt,1990,Natural Disaster,"Devastating floods hit several regions, causing loss of life and extensive damage to infrastructure."
Egypt,1990,Archaeological Discovery,"Significant archaeological findings were unveiled, shedding new light on ancient Egyptian civilization and attracting global attention to Egypt's historical heritage."
Egypt,1991,International Relations Strengthening,"Egypt's relations with Western countries strengthened post-regional conflict, resulting in increased economic aid and political support, influencing its international standing."
Egypt,1991,Economic Policy Changes,"Continued economic liberalization and privatization of state-owned enterprises marked Egypt's commitment to economic reform, affecting the workforce and economic structure."
Egypt,1991,Tourism Initiative,"The government launched initiatives to boost tourism, a major source of national income, through marketing campaigns and infrastructure improvements, aiming to attract more international visitors."
Egypt,1991,Gulf War,"Egypt's participation in the coalition against Iraq, sending troops and resources to the Gulf region."
Egypt,1991,Terrorism,"Terrorist attacks targeting tourist sites, leading to a decline in tourism and concerns over security."
Egypt,1991,Environmental Crisis,"Severe air pollution in major cities, prompting government action to address environmental degradation."
Egypt,1992,Social Unrest,"Protests and clashes between security forces and Islamist groups, leading to arrests and political tension."
Egypt,1992,Corruption Scandal,"High-profile corruption scandal involving government officials, triggering public outrage and calls for accountability."
Egypt,1992,Religious Conflict,"Sectarian violence between religious communities, raising concerns about social cohesion and minority rights."
Egypt,1992,Education Reform,Government initiatives to reform the education system and improve literacy rates.
Egypt,1992,Economic Growth,Positive economic indicators showing growth in GDP and foreign investment inflows.
Egypt,1992,Earthquake,"A devastating earthquake struck, causing significant loss of life, injuries, and widespread damage to buildings and infrastructure, leading to major reconstruction efforts."
Egypt,1992,Political Unrest,"Instances of political unrest and demonstrations occurred, reflecting public dissatisfaction with government policies, economic conditions, and political restrictions."
Egypt,1992,Cultural Heritage Preservation,"Efforts were intensified to preserve Egypt's cultural heritage, including ancient monuments and sites, amid growing concerns about environmental and human threats."
Egypt,1993,Economic Agreement,"Egypt entered into significant economic agreements with international bodies, securing loans and financial support aimed at further economic reforms and development projects."
Egypt,1993,Legal Reforms,"The government undertook legal reforms to modernize the judicial system, impacting civil liberties, legal proceedings, and the rule of law."
Egypt,1993,Infrastructure Development,"Major infrastructure projects were launched, including road, bridge, and housing developments, aimed at improving living conditions and stimulating economic growth."
Egypt,1993,Peace Accord,"Signing of a peace agreement with neighboring country, aiming to resolve long-standing border disputes."
Egypt,1993,Humanitarian Crisis,"Refugee influx from neighboring conflict zones, straining resources and prompting international aid efforts."
Egypt,1993,Media Freedom,"Crackdown on independent media outlets, leading to censorship and restrictions on press freedom."
Egypt,1993,Healthcare Reform,Government initiatives to expand healthcare access and improve medical services nationwide.
Egypt,1994,International Summit,"Hosting of a major international summit, showcasing Egypt's diplomatic role in the region."
Egypt,1994,Cultural Festival,"Organizing a cultural festival to promote arts, heritage, and tourism."
Egypt,1994,Judicial Reform,Efforts to reform the judicial system to enhance transparency and efficiency.
Egypt,1994,Drought,"Severe drought affecting agricultural production and water resources, leading to food shortages."
Egypt,1994,Labor Migration,"Increasing emigration of skilled workers seeking opportunities abroad, impacting labor market dynamics."
Egypt,1994,Tourism Security Incidents,"The tourism industry faced challenges due to security incidents targeting tourists, impacting Egypt's image as a safe tourist destination and economic revenues."
Egypt,1994,Water Resource Management,"Initiatives were taken to address water scarcity and management of the Nile River, involving negotiations with neighboring countries and investment in water infrastructure."
Egypt,1994,Educational Reforms,"The government introduced reforms in the education system aimed at improving quality and access, reflecting the growing emphasis on human capital development."
Egypt,1995,Political Assassination Attempt,"A high-profile political figure survived an assassination attempt, leading to a crackdown on extremist groups and increased security measures."
Egypt,1995,Economic Conference,"Egypt hosted an international economic conference to attract foreign investment, showcasing economic reforms and opportunities in various sectors."
Egypt,1995,Media Expansion,"The media landscape expanded with the introduction of private and satellite television channels, changing the information environment and public discourse."
Egypt,1995,Legislative Elections,"Conducting parliamentary elections with contested results, raising concerns about electoral integrity."
Egypt,1995,Natural Disaster,"Earthquake hits populated areas, causing casualties and damage to infrastructure."
Egypt,1995,Social Welfare Programs,Expansion of social welfare programs to alleviate poverty and support vulnerable populations.
Egypt,1995,Technology Boom,Growth of technology sector with the emergence of startups and investment in telecommunications.
Egypt,1995,Diplomatic Crisis,"Diplomatic tension with neighboring country over border disputes, leading to heightened military presence."
Egypt,1996,Economic Diversification,Efforts to diversify the economy away from reliance on traditional sectors such as agriculture.
Egypt,1996,Environmental Conservation,"Initiatives to protect natural habitats and biodiversity, including national park establishment."
Egypt,1996,Infrastructure Investment,Major investments in infrastructure projects to enhance transportation and utilities.
Egypt,1996,Trade Agreements,Negotiation of trade agreements with regional and international partners to boost exports.
Egypt,1996,Terrorism,"Terrorist attacks targeting tourist destinations, causing a decline in tourism revenue."
Egypt,1996,Cultural Festival,"Egypt hosted a major international cultural festival, enhancing its cultural diplomacy and reinforcing its role as a cultural leader in the region."
Egypt,1996,Agricultural Development,"New agricultural policies and projects were introduced to boost productivity and sustainability, addressing food security and rural development."
Egypt,1996,Banking Sector Reform,"Reforms in the banking sector were initiated to enhance financial stability, attract investments, and modernize the financial system."
Egypt,1997,Terrorist Attack on Tourists,"A major terrorist attack targeting tourists resulted in significant casualties, severely impacting the tourism industry and leading to increased security measures."
Egypt,1997,Population Policy,"The government launched initiatives to address population growth, focusing on family planning, public health, and education programs."
Egypt,1997,Trade Agreements,"Egypt signed important trade agreements to enhance economic cooperation and access to international markets, aiming to boost exports and economic growth."
Egypt,1997,Education Reform,Overhaul of the education curriculum to emphasize critical thinking and modern skills.
Egypt,1997,Healthcare Access,Expansion of healthcare services in rural areas to improve access for underserved communities.
Egypt,1997,Political Demonstrations,"Protests against government policies, calling for greater democracy and civil liberties."
Egypt,1997,Technological Advancement,"Investment in research and development, fostering innovation and entrepreneurship."
Egypt,1997,Humanitarian Aid,Providing aid and support to neighboring countries facing humanitarian crises.
Egypt,1998,Educational Infrastructure Expansion,"Significant investments were made in expanding educational infrastructure, including building new schools and universities, to improve access to education."
Egypt,1998,Health Care Reform,"Initiatives to reform the healthcare system were introduced, aiming at improving healthcare services, accessibility, and public health outcomes."
Egypt,1998,Judicial System Enhancement,"Efforts were made to enhance the independence and efficiency of the judicial system, affecting legal processes, civil rights, and governance."
Egypt,1998,Financial Crisis,"Stock market crash and banking sector instability, leading to economic downturn and government intervention."
Egypt,1998,Cultural Preservation,Conservation efforts for historical sites and artifacts to safeguard cultural heritage.
Egypt,1998,Labor Reforms,Amendments to labor laws to protect workers' rights and improve working conditions.
Egypt,1998,Religious Freedom,Government initiatives to promote religious tolerance and protect minority rights.
Egypt,1998,International Development,Collaboration with international organizations on development projects in key sectors.
Egypt,1999,Economic Growth Initiative,"The government implemented new policies aimed at stimulating economic growth, attracting foreign direct investment, and promoting private sector development."
Egypt,1999,Environmental Protection Measures,"New measures were introduced to protect the environment, addressing pollution, conservation, and sustainable development challenges."
Egypt,1999,Telecommunications Expansion,"The telecommunications sector witnessed significant expansion and liberalization, facilitating greater connectivity, information technology development, and economic diversification."
Egypt,1999,Political Transition,"Transition of power following presidential elections, marking a shift in the country's leadership."
Egypt,1999,Environmental Awareness,Awareness campaigns on environmental conservation and sustainable development.
Egypt,1999,Urban Planning,Urban renewal projects to address overcrowding and improve living conditions in cities.
Egypt,1999,Educational Expansion,"Expansion of educational opportunities, including scholarships and vocational training programs."
Egypt,1999,Infrastructure Development,Infrastructure upgrades to enhance connectivity and facilitate economic growth.
Egypt,2000,Legislative Elections,"Legislative elections took place amid discussions on political reform, electoral transparency, and participation, reflecting the dynamics of political life."
Egypt,2000,Water Agreement,"Egypt engaged in negotiations and agreements over the management and usage of Nile waters, reflecting the strategic importance of water resources and regional cooperation."
Egypt,2000,Cultural Heritage Recognition,"Several Egyptian sites were designated as World Heritage Sites, acknowledging their universal value and boosting cultural tourism and preservation efforts."
Egypt,2001,Economic Policy Adjustment,"In response to global economic changes, Egypt adjusted its economic policies, focusing on macroeconomic stability, structural reforms, and social safety nets."
Egypt,2001,International Tourism Campaign,"A major campaign was launched to revitalize international tourism, highlighting Egypt's historical attractions and cultural experiences amid global challenges."
Egypt,2001,Terrorist Attack,"A terrorist attack targeting tourists occurred at a historical site in southern Egypt, resulting in multiple casualties."
Egypt,2001,Political Violence,Violent clashes erupted between police forces and protesters during political demonstrations in Cairo.
Egypt,2001,Airplane Crash,"A commercial airliner crashed shortly after takeoff from an Egyptian airport, leading to significant loss of life."
Egypt,2001,Election Controversy,Controversy surrounded the parliamentary elections due to allegations of fraud and irregularities.
Egypt,2001,Economic Crisis,"Egypt faced economic challenges marked by inflation, unemployment, and a decline in foreign investment."
Egypt,2001,Technological Education Initiative,"A national initiative to promote technological education and digital literacy was introduced, aiming at workforce development and economic competitiveness."
Egypt,2002,Agricultural Modernization,"Efforts to modernize agriculture through technology, irrigation improvements, and crop diversification were intensified, aiming at enhancing productivity and food security."
Egypt,2002,Urban Development Projects,"Large-scale urban development projects were initiated, including new cities and housing, to address population growth, urbanization, and housing needs."
Egypt,2002,Media Liberalization,"The media sector saw further liberalization with the introduction of new private media outlets and digital platforms, impacting public discourse and information access."
Egypt,2002,Islamist Insurgency,"The government intensified its crackdown on Islamist militants, leading to clashes and arrests in various parts of the country."
Egypt,2002,Political Assassination,"A prominent political figure was assassinated in Cairo, sparking outrage and raising concerns about stability."
Egypt,2002,Train Collision,"Two trains collided in a rural area, causing numerous deaths and injuries."
Egypt,2002,Labor Unrest,Workers across various sectors engaged in strikes and protests demanding better wages and working conditions.
Egypt,2003,Economic Reform Program,"A comprehensive economic reform program was launched, aimed at fiscal consolidation, privatization, and enhancing the business environment, impacting economic growth and investment."
Egypt,2003,Constitutional Amendment,"Amendments to the constitution were proposed, addressing presidential term limits and election procedures, sparking public debate on political reforms and governance."
Egypt,2003,Natural Gas Development,"Significant developments in the natural gas sector, including discoveries and export agreements, impacted energy policy, economic revenues, and international energy markets."
Egypt,2003,Human Rights Violations,"Reports of human rights abuses, including torture and arbitrary detention, raised international concerns about Egypt's record."
Egypt,2003,Cultural Heritage Theft,"Antiquities theft continued to be a problem, with valuable artifacts stolen from museums and archaeological sites."
Egypt,2003,Drought,Severe drought conditions affected agricultural production and exacerbated water scarcity in certain regions.
Egypt,2003,Food Shortages,Rising food prices and shortages led to protests and social unrest in several cities.
Egypt,2003,Religious Sectarian Violence,"Sectarian violence flared up between different religious communities, resulting in casualties and displacement."
Egypt,2004,Presidential Election,President Hosni Mubarak won a controversial presidential election amid allegations of electoral fraud and repression of opposition.
Egypt,2004,Terrorist Bombings,"Multiple bombings targeted tourist areas in the Sinai Peninsula, causing numerous casualties and dealing a blow to the tourism industry."
Egypt,2004,Labor Strikes,Workers in various industries staged strikes and demonstrations demanding better wages and labor rights.
Egypt,2004,Environmental Disaster,"An oil spill occurred off the coast, causing significant damage to marine life and coastal ecosystems."
Egypt,2004,Infrastructure Collapse,"A bridge collapsed in Cairo, highlighting issues of poor infrastructure maintenance and safety standards."
Egypt,2004,Banking Sector Overhaul,"A major overhaul of the banking sector was undertaken to improve financial stability, efficiency, and integration into the global financial system."
Egypt,2004,Public Health Initiative,"National public health campaigns focusing on infectious diseases and public health awareness were launched, aiming to improve health outcomes and healthcare services."
Egypt,2004,Trade Policy Reform,"Trade policy reforms were implemented to liberalize trade, reduce tariffs, and facilitate entry into global markets, affecting domestic industries and international trade relations."
Egypt,2005,Political Reform Movement,"A movement for political reform gained momentum, advocating for democratic practices, electoral reforms, and greater political freedoms, influencing public discourse and political activism."
Egypt,2005,International Cultural Event,"Egypt hosted an international cultural event, showcasing its heritage and contemporary culture, enhancing cultural exchange and international relations."
Egypt,2005,Renewable Energy Initiatives,"Initiatives to develop renewable energy sources were launched, including solar and wind projects, aiming at diversifying energy sources and promoting environmental sustainability."
Egypt,2005,Train Accident,"A train derailed in Upper Egypt, leading to multiple fatalities and injuries."
Egypt,2005,Freedom of Expression,Journalists and activists faced increased government censorship and restrictions on freedom of expression.
Egypt,2005,Housing Crisis,Protests erupted over inadequate housing conditions and forced evictions in urban areas.
Egypt,2005,Religious Extremism,"Extremist groups carried out attacks targeting religious minorities and moderate voices, fueling sectarian tensions."
Egypt,2006,Sectarian Clashes,"Sectarian clashes between Muslims and Coptic Christians erupted in several towns, resulting in deaths and injuries."
Egypt,2006,Corruption Scandal,"A high-profile corruption scandal implicated government officials and business figures, sparking public outrage."
Egypt,2006,Economic Growth,"Despite challenges, Egypt experienced modest economic growth driven by sectors such as tourism and construction."
Egypt,2006,Political Dissent Crackdown,"Authorities intensified crackdowns on political dissent, arresting opposition figures and activists."
Egypt,2006,Health Crisis,"Outbreaks of infectious diseases, exacerbated by poor sanitation and healthcare infrastructure, affected communities nationwide."
Egypt,2006,Employment and Labor Law Reform,"Reforms in employment and labor laws were introduced to improve labor market flexibility, worker protections, and industrial relations, impacting the workforce and economic development."
Egypt,2006,Education Quality Improvement,"Programs to improve the quality of education, including curriculum development, teacher training, and infrastructure investment, were implemented, aiming to enhance human capital and social development."
Egypt,2006,Water Conservation Campaign,"A national campaign for water conservation was initiated, addressing the challenges of water scarcity, efficient use, and sustainable management of water resources."
Egypt,2007,Economic Growth and Stability,"Egypt experienced significant economic growth and macroeconomic stability, attributed to reforms, increased investment, and tourism, impacting living standards and economic opportunities."
Egypt,2007,Health Insurance Reform,"A comprehensive health insurance reform was proposed to expand coverage, improve service quality, and ensure sustainable healthcare financing, impacting public health and social welfare."
Egypt,2007,Cultural Heritage Preservation Initiative,"Enhanced initiatives for the preservation of cultural heritage were undertaken, focusing on restoration projects, archaeological research, and heritage tourism, contributing to cultural identity and economic development."
Egypt,2007,Election Boycott,"Opposition parties boycotted parliamentary elections, alleging widespread fraud and manipulation by the ruling party."
Egypt,2007,Border Security,The government reinforced security measures along the border with neighboring countries to combat smuggling and illegal immigration.
Egypt,2007,Urban Planning Protests,Protests erupted over controversial urban development projects that threatened to displace communities and destroy historical sites.
Egypt,2007,Education Reform,Reforms aimed at improving the quality of education faced challenges due to funding shortages and bureaucratic obstacles.
Egypt,2007,Environmental Activism,"Environmental activists raised concerns about pollution and unsustainable development practices, advocating for greater conservation efforts."
Egypt,2008,Food Riots,"Widespread riots broke out in response to soaring food prices and shortages, prompting government intervention to stabilize markets."
Egypt,2008,Labor Unrest,"Strikes and labor protests intensified across various sectors, as workers demanded better wages and employment conditions."
Egypt,2008,Political Dissent,"Dissident voices, including bloggers and activists, faced increased repression and censorship by the government."
Egypt,2008,Infrastructure Development,The government launched ambitious infrastructure projects aimed at improving transportation and public services.
Egypt,2008,Diplomatic Tensions,Tensions flared with neighboring countries over issues such as water rights and border disputes.
Egypt,2008,Food Security Strategy,"A national strategy for food security was developed, focusing on agricultural productivity, supply chain improvements, and strategic food reserves, addressing hunger and nutrition challenges."
Egypt,2008,Transport Infrastructure Expansion,"Major investments in transport infrastructure, including roads, bridges, and public transport systems, were made to improve connectivity, urban mobility, and economic efficiency."
Egypt,2008,Environmental Policy Framework,"A comprehensive environmental policy framework was established, addressing pollution control, conservation efforts, and climate change adaptation, aiming at sustainable development and environmental protection."
Egypt,2009,National Identity Project,"A project to issue national ID cards with biometric data was launched, aiming at improving public administration, security, and access to services, impacting citizenship and identity verification."
Egypt,2009,Economic Diversification Efforts,"Efforts to diversify the economy through the development of non-oil sectors, including manufacturing, information technology, and services, were intensified, aiming at sustainable economic growth and job creation."
Egypt,2009,Social Housing Program,"A large-scale social housing program was initiated to address affordable housing needs, urban expansion, and improve living conditions for low-income families."
Egypt,2009,Gaza Conflict,Egypt played a role in brokering a ceasefire agreement between Israel and Hamas following a military conflict in the Gaza Strip.
Egypt,2009,Economic Stimulus,The government implemented economic stimulus measures to mitigate the impact of the global financial crisis on the Egyptian economy.
Egypt,2009,Media Crackdown,"Journalists faced increased censorship and harassment, leading to concerns about freedom of the press."
Egypt,2009,Health Epidemic,An outbreak of a contagious disease led to public health concerns and strained healthcare resources.
Egypt,2009,Labor Migration,"Egyptian workers faced challenges and exploitation abroad, prompting calls for better protection of migrant rights."
Egypt,2010,Parliamentary Elections,"Parliamentary elections were marred by allegations of fraud and irregularities, leading to protests and criticism from opposition groups."
Egypt,2010,Religious Violence,"Sectarian violence erupted in several cities, with clashes between Muslims and Coptic Christians resulting in casualties and property damage."
Egypt,2010,Economic Reform,The government announced economic reform measures aimed at reducing subsidies and attracting foreign investment.
Egypt,2010,Environmental Disaster,"A major oil spill occurred in the Red Sea, causing ecological damage and threatening marine life."
Egypt,2010,Labor Strikes,"Workers across various sectors staged strikes and protests demanding better wages, job security, and labor rights."
Egypt,2010,Political Unrest and Social Movements,"Political unrest and social movements emerged, reflecting growing public dissatisfaction with governance, economic inequality, and calls for political reform, leading to widespread demonstrations and political engagement."
Egypt,2010,Water Diplomacy and Nile Basin Initiative,"Egypt engaged in water diplomacy within the Nile Basin Initiative, aiming at cooperative water management, equitable usage, and conflict resolution among Nile Basin countries."
