Country,Year,Raw Event,Desc
Mexico,2016,Major Hurricane,"A major hurricane struck the Pacific coast, causing widespread damage and prompting national emergency response efforts, highlighting the challenges of climate change and disaster preparedness."
Mexico,2017,Anti-Corruption Legislation,"The government passed new anti-corruption laws, establishing a national anti-corruption system in an effort to tackle endemic corruption, though its effectiveness remained a subject of debate."
Mexico,2017,Earthquake,"A powerful earthquake struck central Mexico, including Mexico City, causing significant destruction and loss of life, leading to widespread emergency response efforts and highlighting issues of urban infrastructure and resilience."
Mexico,2017,Trade Negotiations,"Negotiations to modernize NAFTA took place, with Mexico seeking to preserve trade relations and economic stability amid uncertainties in international trade policies."
Mexico,2017,Journalist Killings,"A series of killings of journalists across the country, highlighting the ongoing risks faced by media workers and the issues of freedom of the press and expression in areas controlled by organized crime."
Mexico,2017,Fuel Theft Crisis,"The escalation of fuel theft, involving illegal taps into pipelines, became a significant issue, causing economic losses, environmental damage, and risks to public safety."
Mexico,2018,Presidential Election,"A landmark presidential election resulted in a landslide victory for the leftist candidate, marking a significant shift in the country's political landscape, with promises of major social, economic, and political reforms."
Mexico,2018,Trade Agreement Replacement,"The agreement to replace NAFTA with the United States-Mexico-Canada Agreement (USMCA) aimed at maintaining and enhancing trade relationships while introducing new labor, environmental, and automotive sector provisions."
Mexico,2018,Migrant Caravan,"The arrival of a large migrant caravan from Central America, seeking asylum in the United States but stuck at the Mexican border, brought international attention to migration issues, humanitarian concerns, and Mexico-US relations."
Mexico,2018,Airport Referendum,"A public referendum led to the cancellation of a partially built, multibillion-dollar new airport for Mexico City, reflecting the new administration's approach to public consultation and fiscal responsibility."
Mexico,2018,Fight Against Fuel Theft,"The government launched a major initiative to combat fuel theft, leading to fuel shortages in parts of the country due to pipeline closures and efforts to secure fuel distribution, highlighting the challenges of tackling organized crime and corruption."
Mexico,2019,US Tariff Threats,"The United States threatened to impose tariffs on all Mexican imports in response to migration issues, leading to negotiations that resulted in Mexico taking stronger measures against unauthorized migration flows."
Mexico,2019,Sargassum Seaweed Invasion,"Beaches in tourist destinations faced unprecedented invasions of sargassum seaweed, affecting the tourism industry and prompting efforts to address the environmental and economic impacts."
Mexico,2019,Culiacan Operation,"A law enforcement operation to capture a high-profile criminal in Culiacan led to widespread violence and a controversial decision to release the detainee, sparking debate over security policy and the rule of law."
Mexico,2019,Feminist Protests,"A surge in feminist protests against gender-based violence and femicides, leading to significant public demonstrations and calls for government action to protect women's rights and ensure justice."
Mexico,2019,Maya Train Project,"The government initiated the Maya Train project, a major infrastructure initiative to boost tourism and economic development in the southeastern region, despite environmental and indigenous rights concerns."
Mexico,2020,COVID-19 Pandemic,"The global COVID-19 pandemic severely impacted Mexico, with significant health, economic, and social challenges, including strain on the healthcare system, economic downturn, and adjustments to daily life and government response."
Mexico,2020,USMCA Implementation,"The USMCA trade agreement officially came into effect, marking a new era in North American trade relations, with implications for Mexico's economy, labor rights, and environmental commitments."
Mexico,2020,Arrest of Former Defense Minister,"The arrest of Mexico's former defense minister in the United States on charges related to drug trafficking and corruption, later returned to Mexico, highlighted issues of corruption and the military's role in security operations."
Mexico,2020,Energy Policy Controversies,The government's policies favoring state-owned energy companies over renewable energy investments led to domestic and international legal challenges and concerns about environmental commitments and economic impact.
Mexico,2020,Major Earthquake,"A powerful earthquake struck the southern state of Oaxaca, causing damage and prompting emergency responses, underscoring the country's vulnerability to natural disasters and the importance of preparedness and resilience efforts."
Mexico,2021,Vaccination Campaign,"Nationwide efforts to vaccinate the population against COVID-19 began, employing various vaccines to combat the pandemic, with healthcare workers and vulnerable populations prioritized in the initial phases."
Mexico,2021,Legislative Elections,"Mid-term legislative elections took place, impacting the balance of power in the Mexican Congress and influencing future policy directions, including reforms and national projects."
Mexico,2021,Energy Reform Debate,"Significant discussions and legislative moves concerning reforms to the energy sector, focusing on strengthening state-owned entities and impacting foreign investment and environmental policies."
Mexico,2021,Infrastructure Projects,"Progress on major infrastructure projects, including the Mayan Train and the Dos Bocas refinery, aimed at boosting economic development and regional connectivity."
Mexico,2021,Environmental Concerns,"Increased attention on environmental issues, including deforestation and water management challenges, sparking debates on sustainability and conservation efforts."
Mexico,2022,Migration Challenges,"Ongoing challenges related to migration, with Mexico playing a central role in regional efforts to manage migration flows from Central America towards the United States, impacting diplomatic relations and human rights discussions."
Mexico,2022,Economic Recovery Initiatives,"Efforts to recover from the economic impacts of the COVID-19 pandemic, including initiatives to stimulate growth, support small businesses, and attract foreign investment."
Mexico,2022,International Trade Agreements,"Negotiations and discussions on international trade agreements to bolster economic ties, with particular focus on North American partners and diversifying trade relations."
Mexico,2022,Social Programs Expansion,"Expansion of social programs aimed at reducing poverty, improving education and healthcare access, reflecting government priorities in social welfare."
Mexico,2022,Anti-Corruption Measures,"Continued efforts to address corruption, including high-profile investigations and legal reforms, part of ongoing efforts to enhance transparency and governance."
Mexico,2023,Judicial Reforms,"Debates and movements towards judicial reforms, aimed at enhancing the efficiency and independence of the judiciary, sparking discussions on separation of powers and rule of law."
Mexico,2023,Renewable Energy Initiatives,"Initiatives to increase the use of renewable energy sources, amidst global and national discussions on climate change and energy transition, reflecting efforts to meet environmental commitments."
Mexico,2023,Public Health Strategies,"Implementation of new public health strategies to address ongoing challenges from the COVID-19 pandemic and prepare for future health crises, focusing on resilience and accessibility."
Mexico,2023,Digital Transformation,"Efforts towards digital transformation in government services and the economy, aiming to enhance connectivity, digital education, and support for the tech industry."
Mexico,2023,Regional Development Programs,"Continued focus on regional development programs to address economic disparities, with emphasis on infrastructure, education, and job creation in less developed areas."
