Country,Year,Raw Event,Desc
Mexico,1990,Economic Liberalization Measures,"The government implemented significant economic reforms aimed at liberalizing the economy, attracting foreign investment, and reducing state control over key sectors."
Mexico,1990,Trade Agreement Negotiations,Initiation of negotiations for a comprehensive trade agreement with neighboring countries to foster economic integration and increase exports.
Mexico,1990,Political Reforms,"Introduction of political reforms to promote democratic processes, including electoral reforms aimed at ensuring fairer elections and political plurality."
Mexico,1990,Environmental Legislation,The enactment of new environmental laws aimed at addressing pollution and promoting sustainable development amidst growing concerns about environmental degradation.
Mexico,1990,Indigenous Rights Movements,"Increased visibility and activism of Indigenous rights movements, advocating for land rights, cultural recognition, and social justice."
Mexico,1991,Educational Reforms,"Implementation of significant reforms in the education system to improve access, quality, and equity in education across the country."
Mexico,1991,Economic Stabilization Efforts,"Efforts to stabilize the economy following periods of inflation and financial instability, including monetary policy adjustments and fiscal reforms."
Mexico,1991,Urban Development Projects,"Launch of major urban development projects to modernize infrastructure, transportation, and public services in major cities."
Mexico,1991,Cultural Initiatives,"Promotion of cultural initiatives and events to celebrate Mexico’s heritage, including festivals, exhibitions, and international cultural exchanges."
Mexico,1991,International Sporting Events,"Hosting of international sporting events, showcasing Mexico as a venue for global sports and fostering national pride."
Mexico,1992,Land Reform Legislation,"Enactment of legislation to reform land ownership policies, aimed at resolving long-standing disputes and promoting agricultural development."
Mexico,1992,Diplomatic Relations,"Establishment or strengthening of diplomatic relations with several countries, expanding Mexico’s international presence and cooperation."
Mexico,1992,Banking Sector Reforms,"Reforms in the banking sector to promote financial stability, liberalization, and competition, including privatization of state-owned banks."
Mexico,1992,Healthcare Initiatives,"Introduction of initiatives to improve healthcare access and quality, addressing public health challenges and disparities."
Mexico,1992,Natural Disaster Response,"Response to significant natural disasters, emphasizing the need for improved disaster preparedness and response mechanisms."
Mexico,1993,Free Trade Agreement Implementation,"Implementation of a landmark free trade agreement with major trading partners, significantly impacting the economy and trade relations."
Mexico,1993,Constitutional Reforms,"Approval of constitutional reforms to strengthen governance, human rights, and the judicial system, aiming to promote democracy and rule of law."
Mexico,1993,Indigenous Cultural Recognition,"Efforts to recognize and preserve Indigenous cultures and languages, including legal and educational initiatives."
Mexico,1993,Tourism Development Strategy,"Launch of strategies to develop and promote tourism, aiming to capitalize on Mexico’s cultural and natural attractions."
Mexico,1993,Public Security Initiatives,"Implementation of initiatives aimed at improving public security, addressing crime, and enhancing law enforcement capabilities."
Mexico,1994,Political Assassination,"The assassination of a leading political candidate, leading to national shock, political turmoil, and increased focus on political violence."
Mexico,1994,Economic Crisis,"A financial crisis triggered by currency devaluation, leading to economic instability, international bailouts, and long-term economic reforms."
Mexico,1994,Armed Rebellion,"An armed rebellion in the south by Indigenous and peasant groups, calling for land rights, social justice, and political reform, drawing international attention."
Mexico,1994,Electoral Reforms,"Further electoral reforms to ensure more transparent and equitable elections, in response to demands for greater democracy."
Mexico,1994,NAFTA Implementation,"The North American Free Trade Agreement (NAFTA) comes into effect, integrating Mexico's economy with those of the United States and Canada, leading to significant economic and social impacts."
Mexico,1995,Economic Stabilization Plan,"Introduction of an economic stabilization plan to address the financial crisis, involving austerity measures, financial support from international organizations, and structural reforms."
Mexico,1995,Social Programs Expansion,"Expansion of social programs aimed at poverty alleviation, education, and health care to address social disparities and promote social welfare."
Mexico,1995,Judicial Reforms,"Implementation of judicial reforms to enhance the independence, efficiency, and integrity of the judiciary."
Mexico,1995,Infrastructure Investment,"Significant investment in infrastructure, including transportation and communication networks, to support economic recovery and development."
Mexico,1995,Environmental Conservation Efforts,"Increased efforts in environmental conservation, including initiatives to protect biodiversity and address the challenges of climate change."
Mexico,1996,Political Reform,"Comprehensive political reforms were enacted to enhance electoral fairness and transparency, aiming to strengthen democracy and reduce the dominance of a single party."
Mexico,1996,Economic Stabilization,"Following a severe economic crisis, measures were implemented to stabilize the economy, including reforms in banking and financial sectors to restore investor confidence."
Mexico,1996,Environmental Legislation,"New environmental legislation was introduced to address pollution and protect natural resources, reflecting growing environmental awareness and the need for sustainable development."
Mexico,1996,Indigenous Rights Agreement,"The government and indigenous groups reached an agreement on rights and culture, aiming to address long-standing issues of inequality and autonomy."
Mexico,1996,Trade Expansion,"Mexico expanded its international trade relations beyond NAFTA, seeking to diversify its economic partnerships and reduce dependence on the United States."
Mexico,1997,Legislative Elections,"Mid-term elections resulted in significant gains for opposition parties, marking a shift towards a more pluralistic political landscape and reducing the ruling party's dominance."
Mexico,1997,Drug Policy Reforms,"Initiatives were introduced to combat drug trafficking and consumption, including law enforcement and public health measures, in response to growing concerns over narcotics-related violence."
Mexico,1997,Cultural Heritage Promotion,"Efforts were intensified to promote Mexico's cultural heritage and tourism, including the restoration of historic sites and the celebration of indigenous cultures."
Mexico,1997,Infrastructure Development,"Major investments in infrastructure, including transportation and urban development, were made to support economic growth and improve quality of life."
Mexico,1997,Education Reform,"Reforms in the education system were implemented to improve access to quality education, including increased funding and curriculum modernization."
Mexico,1998,Economic Growth,"Mexico experienced significant economic growth, buoyed by strong exports and increased foreign investment, indicating recovery from the mid-1990s financial crisis."
Mexico,1998,Natural Disaster Response,"In response to devastating natural disasters, including hurricanes and floods, Mexico enhanced its disaster preparedness and response mechanisms."
Mexico,1998,Technological Advancement,"The country made strides in technological advancement and access, including the expansion of internet infrastructure and telecommunications services."
Mexico,1998,Health Care Initiatives,"New initiatives were launched to improve public health care systems, aiming to expand access to services and address public health challenges."
Mexico,1998,Environmental Conservation Projects,"Projects were launched to conserve biodiversity and address environmental degradation, highlighting the importance of environmental sustainability."
Mexico,1999,Political Decentralization,"Efforts to decentralize political power, granting more autonomy and resources to local governments, were undertaken to enhance governance and local development."
Mexico,1999,Energy Sector Reform,"Reforms in the energy sector were initiated to attract investment and modernize infrastructure, focusing on efficiency and sustainability."
Mexico,1999,Anti-Corruption Measures,"The government introduced measures to tackle corruption, including the establishment of new oversight bodies and legal frameworks to enhance transparency and accountability."
Mexico,1999,Social Welfare Programs,"Expansion of social welfare programs aimed at reducing poverty and inequality, including initiatives focused on education, health, and social security."
Mexico,1999,Cultural Festivals,"Mexico hosted international cultural festivals to showcase its arts and culture on the global stage, fostering cultural exchange and promoting tourism."
Mexico,2000,Presidential Election,"A landmark presidential election saw the end of the ruling party's seven-decade-long control of the presidency, marking a significant milestone in Mexico's democratic evolution."
Mexico,2000,Economic Policy Shift,"New economic policies aimed at further stabilizing and growing the economy were introduced, focusing on fiscal responsibility and market liberalization."
Mexico,2000,Environmental Agreements,"Mexico participated in international environmental agreements, committing to global efforts to combat climate change and protect biodiversity."
Mexico,2000,Education Technology Integration,"Initiatives to integrate technology into education were launched, aiming to enhance learning outcomes and prepare students for a digital future."
Mexico,2000,Urban Development Projects,"Significant urban development projects were undertaken to address housing, transportation, and urban poverty, aiming to improve living conditions in rapidly growing cities."
Mexico,2001,Political Transition,"A new administration took office, marking the end of a single party's 71-year governance, and initiating a period of political transition aimed at democratization and addressing corruption."
Mexico,2001,Economic Reforms,"Implementation of significant economic reforms aimed at stabilizing the economy, attracting foreign investment, and addressing issues of poverty and inequality."
Mexico,2001,Energy Sector Overhaul,"Launch of initiatives to modernize the energy sector, including efforts to increase efficiency and explore renewable energy sources, aiming to reduce dependence on oil."
Mexico,2001,Indigenous Rights Movement,"A march to the nation's capital by indigenous groups demanding greater rights and autonomy, highlighting ongoing social and political challenges related to indigenous communities."
Mexico,2001,Drug Policy Shift,"Initiatives aimed at combating drug trafficking and violence, including changes in law enforcement strategies and cooperation with international agencies."
Mexico,2002,Education Reform,"Introduction of significant reforms in the education system to improve quality and accessibility, focusing on reducing dropout rates and improving literacy."
Mexico,2002,Environmental Initiatives,"Implementation of new environmental policies aimed at conservation and sustainable development, addressing issues like deforestation and pollution."
Mexico,2002,Trade Agreements Expansion,"Expansion of trade agreements to diversify the economy and strengthen economic ties with other countries, beyond the existing North American Free Trade Agreement."
Mexico,2002,Infrastructure Development,"Launch of major infrastructure projects, including transportation and urban development, to support economic growth and improve quality of life."
Mexico,2002,Public Health Campaigns,"Introduction of national public health campaigns focusing on vaccination, nutrition, and disease prevention, aiming to improve public health outcomes."
Mexico,2003,Fiscal Policy Reform,"Implementation of reforms to the fiscal policy to increase revenue and address issues of tax evasion, aiming to fund public services and social programs."
Mexico,2003,Judicial System Overhaul,"Initiatives to reform the judicial system to improve efficiency, transparency, and access to justice, addressing longstanding issues of corruption and impunity."
Mexico,2003,Cultural Heritage Preservation,Launch of programs aimed at preserving Mexico's cultural heritage and promoting it both domestically and internationally.
Mexico,2003,Water Management Initiatives,"Introduction of comprehensive water management policies to address scarcity, improve distribution, and ensure sustainable use of water resources."
Mexico,2003,Anti-Corruption Measures,"Introduction of measures to combat corruption within public institutions, aiming to restore public trust and improve governance."
Mexico,2004,Labor Market Reform,"Introduction of labor market reforms to increase flexibility, promote job creation, and improve workers' rights, amid debates on impact and implementation."
Mexico,2004,Energy Investment,"Announcement of significant investments in the energy sector, including oil and gas exploration and the development of renewable energy sources."
Mexico,2004,Border Security Enhancement,"Strengthening of border security measures to address issues of drug trafficking, human trafficking, and migration, in cooperation with neighboring countries."
Mexico,2004,Tourism Promotion Initiatives,"Launch of initiatives to promote tourism, focusing on cultural, historical, and natural attractions, aiming to boost the economy and create jobs."
Mexico,2004,Rural Development Programs,"Implementation of programs aimed at rural development, focusing on agriculture, small business support, and infrastructure improvements to reduce rural poverty."
Mexico,2005,Pension System Reform,"Reform of the pension system to ensure sustainability, expand coverage, and address the needs of an aging population."
Mexico,2005,Urban Renewal Projects,"Introduction of urban renewal projects aimed at revitalizing cities, improving public spaces, and addressing urban poverty and housing issues."
Mexico,2005,Renewable Energy Push,"Launch of initiatives to promote the use of renewable energy sources, aiming to reduce environmental impact and foster sustainable development."
Mexico,2005,Crime Reduction Strategies,"Implementation of strategies to reduce crime rates, including community policing and crime prevention programs, aiming to improve public safety."
Mexico,2005,Foreign Policy Initiatives,"Efforts to strengthen Mexico's role in international affairs, including participation in peacekeeping and addressing regional challenges."
Mexico,2006,Electoral Controversy,"A closely contested presidential election led to widespread protests and a call for a recount, reflecting deep political divisions within the country."
Mexico,2006,Anti-Drug Initiative Launch,"The government announced a major crackdown on drug cartels, initiating a militarized approach to combat drug trafficking, which led to an escalation in violence and confrontations across several regions."
Mexico,2006,Economic Policy Reform,"Implementation of significant reforms aimed at improving economic stability and growth, including changes in taxation and energy sector policies."
Mexico,2006,Natural Disaster Response,"A powerful hurricane caused extensive damage on the Pacific coast, prompting national emergency response efforts and international aid."
Mexico,2006,Cultural Milestone,"A significant discovery of ancient archaeological ruins, offering new insights into Mexico's pre-Columbian history and attracting global attention to the country's rich cultural heritage."
Mexico,2007,Justice System Reform,"Enactment of comprehensive reforms to the justice system, aiming to enhance transparency, efficiency, and the rule of law in criminal proceedings."
Mexico,2007,Environmental Initiative,"Launch of a national initiative focused on environmental conservation and sustainable development, targeting pollution reduction and protection of natural resources."
Mexico,2007,Public Health Campaign,"A nationwide campaign against obesity and diabetes was launched, addressing growing concerns over public health and lifestyle diseases."
Mexico,2007,Infrastructure Development Program,"Announcement of a major infrastructure development program, focusing on transportation, urban development, and water management projects."
Mexico,2007,International Trade Agreement Expansion,Negotiation and expansion of international trade agreements to bolster Mexico's economy and global trade relations.
Mexico,2008,Financial Crisis Impact,"The global financial crisis significantly impacted Mexico's economy, leading to recessionary pressures and prompting government interventions."
Mexico,2008,Energy Sector Reform,"Legislative reforms in the energy sector aimed at boosting production and investment, particularly in oil and natural gas."
Mexico,2008,Social Security Reform,"Reforms to the social security system were implemented, focusing on pension schemes and healthcare benefits for an aging population."
Mexico,2008,Drug Cartel Violence Escalation,"An escalation in drug cartel violence, marked by high-profile incidents and challenges to state authority, highlighting the ongoing security crisis."
Mexico,2008,Cultural Heritage Promotion,"Efforts to promote Mexico's cultural heritage globally, including UNESCO World Heritage site designations and cultural festivals, enhancing tourism and international recognition."
Mexico,2009,Pandemic Outbreak Response,"Response to the H1N1 influenza outbreak, marked by public health measures, international collaboration, and efforts to mitigate the impact of the pandemic."
Mexico,2009,Education Reform Initiative,"Launch of initiatives aimed at reforming education, improving quality and access, and addressing challenges in rural and underserved communities."
Mexico,2009,Renewable Energy Investments,"Increased investments in renewable energy projects, focusing on solar and wind energy, to diversify energy sources and reduce carbon emissions."
Mexico,2009,Anti-Corruption Measures,"Implementation of measures to combat corruption within public institutions, aiming to improve governance and public trust."
Mexico,2009,Human Rights Advocacy,"Significant human rights advocacy efforts, focusing on indigenous rights, gender equality, and protection of journalists and activists."
Mexico,2010,Bicentennial Celebrations,"Nationwide celebrations marking 200 years of independence, showcasing Mexico's history, culture, and achievements through various events and commemorations."
Mexico,2010,Major Infrastructure Collapse,"A significant infrastructure collapse, prompting national discussions on safety standards, emergency response, and infrastructure investment."
Mexico,2010,International Sporting Event Hosting,"Hosting a major international sporting event, enhancing Mexico's global profile and stimulating economic and infrastructure development."
Mexico,2010,Drug Legalization Debate,"Debates over drug policy, including proposals for legalization and decriminalization of certain substances, in response to drug-related violence and health issues."
Mexico,2010,Migration Policy Reform,"Efforts to reform migration policy, addressing issues of migrant rights, border security, and bilateral relations with neighboring countries."
Mexico,2011,Drug War Escalation,"Nationwide, the ongoing conflict between government forces and drug cartels intensified, resulting in widespread violence, thousands of deaths, and significant social and economic impact."
Mexico,2011,Major Sports Victory,"The national team achieved a significant victory in a regional football tournament, sparking national pride and celebrations across the country."
Mexico,2011,Education Reform,"The government announced major reforms to the education system aiming to improve quality, accessibility, and performance, sparking debates among educators, parents, and policymakers."
Mexico,2011,Natural Disaster,"A powerful hurricane hit the country's coast, causing extensive damage to infrastructure, homes, and agriculture, and leading to significant efforts in rescue, recovery, and rebuilding."
Mexico,2011,International Summit Hosting,"Mexico hosted an international summit, bringing together leaders from various countries to discuss economic, environmental, and security issues, enhancing its role on the global stage."
Mexico,2012,Presidential Election,"A national election resulted in a change of government, marked by extensive debates on issues such as corruption, violence, and economic policy, affecting the political landscape."
Mexico,2012,Telecommunications Reform,"The government introduced significant reforms to the telecommunications sector to increase competition, reduce prices, and improve service quality, impacting consumers and businesses."
Mexico,2012,Tourism Initiative,"The launch of a major initiative to promote tourism, aiming to showcase the country's cultural and natural attractions, boosting the economy and creating jobs."
Mexico,2012,Education Protest,"Large-scale protests by students and teachers against proposed educational reforms, highlighting tensions over policy direction and the future of public education."
Mexico,2012,Energy Sector Reform,"Announcements of plans to reform the energy sector, aiming to attract investment, boost production, and address sustainability concerns."
Mexico,2013,Financial Reform,"Implementation of comprehensive financial reforms to strengthen the banking system, increase credit availability, and support economic growth."
Mexico,2013,Security Strategy Shift,"The government announced a shift in security strategy to address drug violence, focusing on prevention, community development, and law enforcement reform."
Mexico,2013,Infrastructure Development Plan,"Launch of an ambitious infrastructure development plan, including transportation, energy, and urban projects, aimed at supporting economic growth and improving quality of life."
Mexico,2013,Cultural Recognition,"A Mexican tradition was recognized by UNESCO as an Intangible Cultural Heritage, highlighting the country's rich cultural heritage and traditions."
Mexico,2013,International Trade Agreement,"Mexico participated in negotiations for a major international trade agreement, aiming to expand market access and boost the economy."
Mexico,2014,Energy Sector Liberalization,"Historic reforms opened the energy sector to foreign and private investment for the first time in decades, aiming to modernize the industry and increase production."
Mexico,2014,Public Protest Movement,"Nationwide protests erupted over issues of corruption, violence, and governance, reflecting deep social and political unrest."
Mexico,2014,Telecommunications Expansion,"Significant progress in expanding broadband and telecommunications access, aimed at reducing the digital divide and supporting economic development."
Mexico,2014,Environmental Policy,"The government introduced new environmental policies to address climate change, protect natural resources, and promote sustainable development."
Mexico,2014,Cultural Festival,"A major cultural festival showcased Mexico's arts, music, and literature, attracting international attention and promoting cultural exchange."
Mexico,2015,Anti-Corruption Measures,"The government enacted new anti-corruption measures, including the creation of a national anti-corruption system, in response to public demand for greater transparency and accountability."
Mexico,2015,Educational Quality Initiative,"Launch of initiatives to improve educational quality and outcomes, including teacher evaluations and curriculum reforms, amid ongoing debates about education policy."
Mexico,2015,International Sporting Event,"Mexico hosted an international sporting event, highlighting the country's capabilities in organizing large-scale events and promoting international tourism and goodwill."
Mexico,2015,Trade Agreement Implementation,"Implementation of provisions of a new trade agreement with multiple countries, aimed at boosting the economy through increased trade and investment opportunities."
Mexico,2015,Renewable Energy Investment,"Announcement of significant investments in renewable energy projects, reflecting a commitment to reducing carbon emissions and promoting sustainable energy sources."
Mexico,2016,Educational Reform Protests,"Nationwide protests erupted over proposed educational reforms, focusing on teacher evaluations and hiring practices, leading to clashes between teachers' unions and government forces in various states."
Mexico,2016,Energy Sector Reform,"The government implemented significant reforms in the energy sector, opening up the oil and gas markets to private and foreign investors for the first time in over 70 years, aiming to boost the economy and modernize the energy infrastructure."
Mexico,2016,US Presidential Election Impact,"The election of a new US president led to concerns over trade policies, immigration, and bilateral relations, especially regarding the future of the North American Free Trade Agreement (NAFTA) and the proposal of a border wall."
Mexico,2016,Currency Depreciation,"The Mexican peso experienced significant depreciation against the US dollar, affecting the economy and leading to increased inflation, partially due to international geopolitical tensions and domestic concerns."
