Country,Year,Raw Event,Desc
Netherlands,2019,Legal Landmark,"A landmark legal decision was made, with far-reaching implications for environmental policy and governmental accountability, setting a precedent in environmental jurisprudence."
Netherlands,2019,Technological Breakthrough,"The country announced a technological breakthrough, further establishing its reputation as a hub for innovation and technology development."
Netherlands,2019,Housing Policy Reform,"Comprehensive reforms in housing policy were implemented to address affordability and availability, tackling one of the most pressing social issues facing the population."
Netherlands,2019,International Cultural Festival,"The Netherlands hosted an international cultural festival, drawing participants from around the world and highlighting its cultural diversity and openness."
Netherlands,2020,COVID-19 Response,"The country faced the global COVID-19 pandemic with public health measures, including lockdowns and a vaccination campaign, impacting society and the economy."
Netherlands,2020,Economic Support Package,"In response to the pandemic, significant economic support packages were introduced to support businesses and individuals affected by economic downturns."
Netherlands,2020,Digital Transition Initiative,"A major initiative to accelerate the digital transition of public services was launched, aiming to improve accessibility, efficiency, and resilience in the face of changing global conditions."
Netherlands,2020,Environmental Action Plan,"A new environmental action plan was unveiled, aiming to address pollution, biodiversity loss, and sustainable development challenges, reaffirming the country's environmental commitments."
Netherlands,2020,International Cooperation Effort,"The Netherlands initiated a significant international cooperation effort, aimed at addressing global challenges such as health crises, climate change, and international security."
Netherlands,2021,Government Resignation,"The Dutch government resigned due to a scandal involving the mismanagement of childcare benefits, affecting thousands of families and leading to a political crisis."
Netherlands,2021,COVID-19 Measures and Protests,"The government implemented strict COVID-19 measures to curb the spread of the virus, leading to widespread protests across the country against lockdowns and vaccination mandates."
Netherlands,2021,General Elections,"General elections were held, resulting in a fragmented parliament and initiating complex coalition negotiations amid discussions on pandemic recovery and climate policy."
Netherlands,2021,Floods,"Severe flooding affected parts of the Netherlands, highlighting concerns about climate change and the country's vulnerability to rising sea levels and extreme weather events."
Netherlands,2021,Climate Action Plan,"The government announced ambitious plans to reduce greenhouse gas emissions, focusing on sustainable energy and infrastructure projects to combat climate change."
Netherlands,2022,Ukraine Support,"In response to the international conflict in Ukraine, the Netherlands provided support to Ukraine, including humanitarian aid and sanctions against aggressors, reflecting its stance on international law and human rights."
Netherlands,2022,Energy Crisis Response,"Facing an energy crisis exacerbated by global events, the government implemented measures to secure energy supplies and support affected households and businesses."
Netherlands,2022,Infrastructure Investment,"Significant investments were made in infrastructure, including transport and digital connectivity, aiming to modernize the country's infrastructure and boost economic growth."
Netherlands,2022,Nitrogen Emission Reduction,"The government proposed stringent measures to reduce nitrogen emissions, sparking protests from farmers and raising debates on environmental policy and agricultural practices."
Netherlands,2022,Cultural and Sporting Events,"The Netherlands hosted several major cultural and sporting events, showcasing its ability to organize large-scale events and promoting cultural exchange."
Netherlands,2023,Political Reforms,"The government initiated political reforms to address issues such as housing, immigration, and healthcare, aiming to improve public services and social cohesion."
Netherlands,2023,Renewable Energy Projects,"Launch of significant renewable energy projects, including wind and solar energy farms, to meet the country's ambitious climate targets and reduce dependency on fossil fuels."
Netherlands,2023,Technological Innovation Initiatives,"The country emphasized technological innovation, including artificial intelligence and blockchain, to maintain its position as a leading tech hub in Europe."
Netherlands,2023,International Diplomacy,"The Netherlands played a key role in international diplomacy, focusing on European Union relations, global security, and trade agreements, reflecting its commitment to multilateralism."
Netherlands,2023,Environmental Conservation Efforts,"Enhanced efforts in environmental conservation, including protection of the North Sea ecosystems and sustainable agriculture practices, highlighting the country's commitment to biodiversity and sustainable development."
