Country,Year,Raw Event,Desc
Netherlands,1990,Art Theft,"A significant art theft occurred where valuable paintings were stolen from a museum, highlighting issues around art security and cultural heritage."
Netherlands,1990,Environmental Policy,"The government introduced pioneering environmental policies aimed at reducing pollution and promoting sustainability, setting a precedent for future initiatives."
Netherlands,1990,Political Transition,"A new government took office following national elections, marking a shift in domestic and foreign policy directions."
Netherlands,1990,Economic Growth,"The country experienced notable economic growth, reflecting the effectiveness of economic policies and the strength of the Dutch market."
Netherlands,1990,Infrastructure Expansion,"Major infrastructure projects were announced, including transportation and public works, to support the country's growing economy and population needs."
Netherlands,1991,European Integration,"The Netherlands played a key role in advancing European integration, contributing to discussions on the Maastricht Treaty, which led to the creation of the European Union."
Netherlands,1991,Legal Reform,"Significant legal reforms were enacted, including changes to the criminal justice system and social welfare policies, reflecting evolving societal norms."
Netherlands,1991,Cultural Celebration,"The country celebrated a major cultural milestone, highlighting its rich artistic and historical heritage."
Netherlands,1991,International Relations,"The Netherlands hosted international diplomatic meetings, reinforcing its role as a mediator and proponent of global cooperation."
Netherlands,1991,Environmental Initiative,"Launch of significant environmental initiatives aimed at conservation and sustainability, underscoring the country's commitment to environmental issues."
Netherlands,1992,Flood Management,"A major initiative in flood management was launched, addressing the country's vulnerability to flooding and setting a standard for water management technology."
Netherlands,1992,Technological Advancement,"Introduction of groundbreaking technology in various sectors, positioning the Netherlands as a leader in innovation and tech development."
Netherlands,1992,Sports Achievement,"Dutch athletes achieved significant success in international sports competitions, enhancing the country's reputation in the sports world."
Netherlands,1992,Educational Reform,Implementation of comprehensive educational reforms aimed at improving access and quality of education for all segments of society.
Netherlands,1992,Healthcare Improvement,"Major healthcare improvements were introduced, enhancing public health services and accessibility."
Netherlands,1993,Social Policy Reform,"The government introduced reforms in social policy, addressing issues such as employment, healthcare, and social security."
Netherlands,1993,International Peacekeeping,"The Netherlands contributed to international peacekeeping efforts, reflecting its commitment to global peace and security."
Netherlands,1993,Economic Initiative,"Launch of initiatives aimed at bolstering economic innovation and competitiveness, particularly in technology and manufacturing sectors."
Netherlands,1993,Public Transport Expansion,Expansion of the public transport network to improve urban mobility and reduce environmental impact.
Netherlands,1993,Cultural Initiative,"Initiatives to promote Dutch culture and language both domestically and internationally, reinforcing national identity and international cultural exchange."
Netherlands,1994,Political Reform,Introduction of significant political reforms aimed at enhancing democratic processes and governance.
Netherlands,1994,Environmental Summit,"Hosting of an international environmental summit, underscoring the Netherlands' leadership in global environmental advocacy."
Netherlands,1994,Trade Agreements,"Signing of important trade agreements, boosting the economy and strengthening international trade relations."
Netherlands,1994,Science and Research,"Significant investments in science and research, establishing the Netherlands as a hub for scientific innovation and discovery."
Netherlands,1994,Infrastructure Modernization,"Modernization of critical infrastructure, including advancements in digital and transportation networks, to support future growth."
Netherlands,1995,Peace Treaty Role,"The Netherlands played a key role in facilitating a major international peace treaty, contributing to conflict resolution and peacebuilding efforts."
Netherlands,1995,Economic Policy,"Implementation of progressive economic policies aimed at fostering growth, stability, and innovation."
Netherlands,1995,Social Inclusion Initiatives,"Introduction of initiatives aimed at promoting social inclusion and combating discrimination, reflecting a commitment to social justice and equality."
Netherlands,1995,Cultural Heritage,"Significant efforts to preserve and celebrate Dutch cultural heritage, including restoration of historic sites and promotion of cultural arts."
Netherlands,1995,International Sporting Event,"Hosting of an international sporting event, showcasing the Netherlands as a world-class destination for sports and entertainment."
Netherlands,1996,Flood Management,"A significant effort in flood prevention and management following high water levels in rivers, leading to the strengthening of dykes and development of advanced water management techniques, showcasing the country's commitment to combating flood risks."
Netherlands,1996,Technological Advancement,"The introduction of widespread internet access to the public, marking a pivotal step in the country's digital transformation and enhancing connectivity for individuals and businesses."
Netherlands,1996,Environmental Policy,"The adoption of stringent environmental policies aimed at reducing greenhouse gas emissions, highlighting the Netherlands' leadership in environmental sustainability and climate action."
Netherlands,1997,Legal Reform,"The enactment of progressive legislation that significantly expanded the rights and protections for various groups, underscoring the country's commitment to social justice and equality."
Netherlands,1997,Cultural Milestone,"Hosting a major international art exhibition, which drew visitors from around the globe, emphasizing the Netherlands' rich cultural heritage and its impact on the global art scene."
Netherlands,1998,Public Health Initiative,"The launch of a national public health campaign focusing on preventive measures and healthy living, reflecting the government's focus on improving health outcomes for its population."
Netherlands,1998,International Sports Event,"The country hosted a significant international sports competition, showcasing its capacity to organize large-scale events and fostering a sense of national pride and unity."
Netherlands,1998,Infrastructure Expansion,"Major expansion of public transportation infrastructure, including the opening of new rail and metro lines, to improve urban mobility and connectivity."
Netherlands,1999,Economic Policy,"Implementation of economic reforms aimed at stimulating growth, increasing employment, and enhancing the country's competitiveness on the international stage."
Netherlands,1999,Education Reform,"Introduction of significant reforms in the education system to improve access, quality, and outcomes for students across all levels of education."
Netherlands,2000,Legal Milestone,"The Netherlands became the first country in the world to legalize a landmark social policy, setting a global precedent in human rights and personal freedom."
Netherlands,2000,Technological Innovation,"The establishment of a national initiative to support technological innovation and start-ups, aiming to position the Netherlands as a leading hub for technology and entrepreneurship."
Netherlands,2000,Environmental Agreement,"Participation in an international environmental agreement, reaffirming the country's commitment to global sustainability efforts and climate change mitigation."
Netherlands,2000,Cultural Festival,"The organization of a significant cultural festival that celebrated Dutch traditions and attracted international visitors, enhancing cultural exchange and tourism."
Netherlands,2000,International Diplomacy,"Hosting an important international conference aimed at addressing global issues, highlighting the Netherlands' role in international diplomacy and cooperation."
Netherlands,2001,Legalization of Same-Sex Marriage,"The Netherlands became the first country in the world to legalize same-sex marriage, marking a historic moment in the advancement of LGBTQ+ rights."
Netherlands,2001,Foot-and-Mouth Disease Outbreak,"An outbreak of foot-and-mouth disease affected livestock, leading to widespread culling and significant impact on the agricultural sector and rural communities."
Netherlands,2001,Economic Recession,"The country entered an economic recession, influenced by global economic downturns, impacting employment, government spending, and economic policy."
Netherlands,2002,Political Assassination,"The assassination of a controversial political figure sparked nationwide debates on free speech, immigration, and multiculturalism, affecting the political landscape significantly."
Netherlands,2002,Adoption of the Euro,"The Netherlands transitioned from the Dutch guilder to the euro as its official currency, joining other European Union countries in the Economic and Monetary Union."
Netherlands,2002,Flood Management Program Initiation,"A major flood management program was initiated, focusing on reinforcing dikes and flood defenses, reflecting the country's ongoing commitment to combating rising sea levels and protecting its low-lying territories."
Netherlands,2003,Heatwave Impact,"A significant heatwave affected the country, leading to record-breaking temperatures, public health concerns, and discussions on climate change and its impacts."
Netherlands,2003,Introduction of Smoking Ban,"Legislation was introduced to ban smoking in public places, aiming to improve public health and reduce the health impacts associated with secondhand smoke."
Netherlands,2003,Expansion of Wind Energy,"Significant investments in wind energy were made, including the construction of offshore wind farms, as part of the country's efforts to increase renewable energy sources and reduce carbon emissions."
Netherlands,2004,Government Resignation,"The government resigned en masse following a crisis, leading to political instability and discussions on governance, accountability, and policy direction."
Netherlands,2004,Murder of a Filmmaker,"The murder of a filmmaker by an extremist sparked national and international outcry, debates on freedom of expression, and the impact of radicalization in society."
Netherlands,2004,Implementation of Strict Immigration Laws,"New, stricter immigration laws were implemented, reflecting growing debates on national identity, integration, and multiculturalism."
Netherlands,2005,Pension System Reform,"Significant reforms to the pension system were introduced, aiming to ensure long-term sustainability, reflecting broader discussions on aging populations and social welfare."
Netherlands,2005,Ban on Traditional Light Bulbs,"A ban on the sale of traditional incandescent light bulbs was announced, promoting energy efficiency and environmental sustainability as part of a broader European initiative."
Netherlands,2005,International Court Ruling on War Crimes,"A notable international court ruling on war crimes occurred, highlighting the Netherlands' role as host to international judicial institutions and its commitment to upholding international law."
Netherlands,2005,Hosting of Major International Conference,"The Netherlands hosted a major international conference on environmental and sustainability issues, reinforcing its position as a leader in global discussions on climate change and environmental protection."
Netherlands,2006,Government Coalition Formation,"Following general elections, a new government coalition was formed, reflecting the country's complex political landscape and the challenges of coalition politics in a multiparty system."
Netherlands,2006,Environmental Policy Initiative,"The government launched significant initiatives aimed at environmental sustainability and climate change, including efforts to reduce greenhouse gas emissions and promote renewable energy."
Netherlands,2006,International Legal Decision,"A significant ruling by an international court involving the Netherlands, impacting international law and the country's diplomatic relations."
Netherlands,2006,Public Health Campaign,"The introduction of public health campaigns focusing on smoking cessation, reflecting the government's commitment to public health and reducing smoking rates."
Netherlands,2006,Cultural Event,"Hosting a major international cultural event, showcasing the Netherlands' contributions to arts and culture, and attracting global attention."
Netherlands,2007,Economic Reform,"Implementation of major economic reforms aimed at improving the country's competitiveness and economic stability, impacting labor markets, taxation, and public spending."
Netherlands,2007,Infrastructure Expansion,"Announcement and initiation of major infrastructure projects, including transportation and public works, to support economic growth and improve connectivity."
Netherlands,2007,Educational Innovation,"Launch of innovative educational programs and initiatives, aiming to enhance the educational system and promote lifelong learning."
Netherlands,2007,Energy Agreement,"Signing of a significant energy agreement aimed at boosting renewable energy production and securing energy supply, reflecting the country's focus on sustainable energy sources."
Netherlands,2007,Social Policy Initiative,"Introduction of policies aimed at social integration and cohesion, focusing on multiculturalism and integration of immigrant communities."
Netherlands,2008,Financial Crisis Response,"Response to the global financial crisis with measures to stabilize the banking sector and protect the economy, including bank bailouts and economic stimulus packages."
Netherlands,2008,Flood Protection Measures,"Implementation of advanced flood protection measures, highlighting the country's leadership in water management and climate adaptation strategies."
Netherlands,2008,International Sports Achievement,"Achieving notable success in an international sports event, underscoring the Netherlands' strong presence in global sports competitions."
Netherlands,2008,Science and Technology Advancement,"Breakthroughs in science and technology fields, showcasing the Netherlands' contribution to global scientific research and innovation."
Netherlands,2008,Urban Development Project,"Launch of significant urban development projects aimed at revitalizing cities and improving living conditions, reflecting the focus on sustainable urban growth."
Netherlands,2009,Political Leadership Change,"A change in political leadership, impacting the direction of national policy and the country's international standing."
Netherlands,2009,Renewable Energy Initiative,"Expansion of renewable energy initiatives, including wind and solar projects, to meet sustainability goals and reduce reliance on fossil fuels."
Netherlands,2009,Public Transportation Reform,"Reform of the public transportation system to improve efficiency, accessibility, and sustainability, including the introduction of innovative transportation solutions."
Netherlands,2009,Health Care System Reform,"Major reforms in the health care system to improve quality, accessibility, and affordability of health care services for all citizens."
Netherlands,2009,Cultural Heritage Preservation,"Initiatives to preserve and promote Dutch cultural heritage, including restoration of historic sites and support for cultural institutions."
Netherlands,2010,International Event Hosting,"Hosting a major international event, highlighting the Netherlands' role on the global stage and its capacity to organize large-scale international gatherings."
Netherlands,2010,Green Building Initiative,"Implementation of green building initiatives, promoting sustainable construction practices and energy efficiency in housing and commercial buildings."
Netherlands,2010,Cybersecurity Measures,"Introduction of enhanced cybersecurity measures to protect against online threats, reflecting the growing importance of digital security."
Netherlands,2010,Agricultural Innovation,"Advances in agricultural technology and practices, reinforcing the Netherlands' position as a leading country in sustainable agriculture and food production."
Netherlands,2010,Water Management Project,"Launch of innovative water management projects to address challenges of sea-level rise and water scarcity, demonstrating global leadership in hydraulic engineering and water management."
Netherlands,2011,Government Fall,"The government collapsed over disagreements on budget cuts and austerity measures, leading to early elections. This highlighted the country's political volatility and economic challenges during the European debt crisis."
Netherlands,2011,Social Integration Law,"A new law aimed at promoting social integration and the Dutch language among new immigrants was implemented, reflecting ongoing debates about immigration and cultural identity."
Netherlands,2011,Renewable Energy Initiative,"The launch of significant renewable energy projects to reduce dependence on fossil fuels and combat climate change, marking a step towards sustainability."
Netherlands,2011,Major Art Theft,"A significant art theft from a museum involved the loss of several priceless artworks, underscoring issues of cultural heritage protection and security."
Netherlands,2011,Flood Defense Upgrade,"A major initiative to upgrade the country's flood defense systems was announced, in response to growing concerns over climate change and rising sea levels."
Netherlands,2012,Austerity Measures Protest,"Nationwide protests erupted in response to the government's proposed austerity measures, reflecting public discontent with budget cuts and economic policy."
Netherlands,2012,International Court Ruling,"A significant ruling by an international court based in the Netherlands on a high-profile international dispute, reinforcing the country's role in global legal processes."
Netherlands,2012,Technological Innovation Award,"A Dutch company received a prestigious international award for a breakthrough in technology, highlighting the Netherlands' role as a hub for innovation and technology."
Netherlands,2012,Drug Policy Reform,"The government implemented changes to the country's drug policy, affecting the sale of cannabis to tourists in coffee shops, which sparked debates on drug tourism and public health."
Netherlands,2012,Bicycle Infrastructure Expansion,"The expansion of bicycle lanes and infrastructure to promote cycling as a sustainable mode of transportation, reflecting the country's commitment to environmental sustainability and public health."
Netherlands,2013,Royal Succession,"A significant royal event took place, marking the first change in the monarchy in several decades, symbolizing continuity and tradition in Dutch society."
Netherlands,2013,Major Infrastructure Project Completion,"The completion of a large-scale infrastructure project aimed at improving transportation and connectivity, showcasing the country's commitment to modernization and economic growth."
Netherlands,2013,Education Reform,"Implementation of significant reforms in the education system to improve quality and accessibility, reflecting the government's focus on innovation and competitiveness."
Netherlands,2013,International Sporting Event,"The Netherlands hosted a major international sporting event, showcasing the country's cultural vitality and capacity for organizing large-scale events."
Netherlands,2013,Environmental Policy Initiative,"Introduction of new environmental policies aimed at reducing carbon emissions and promoting sustainable practices, part of the country's efforts to address climate change challenges."
Netherlands,2014,Pension System Overhaul,"Major reforms to the national pension system were introduced, aimed at ensuring long-term sustainability and fairness, sparking debates on social security and aging."
Netherlands,2014,Public Health Campaign,"Launch of a nationwide public health campaign to address obesity and promote healthy living, reflecting concerns over public health and preventive care."
Netherlands,2014,Digital Privacy Legislation,"New legislation aimed at enhancing digital privacy and data protection was enacted, in response to growing concerns over online security and individual rights."
Netherlands,2014,International Relations Incident,"An incident affecting international relations occurred, prompting diplomatic efforts and discussions on foreign policy and national security."
Netherlands,2014,Cultural Heritage Initiative,"The government announced initiatives to preserve and promote Dutch cultural heritage, emphasizing the importance of culture in national identity and tourism."
Netherlands,2015,Refugee Crisis Response,"The country's response to the European refugee crisis, involving policy decisions on asylum and integration, highlighted challenges and debates on humanitarianism and security."
Netherlands,2015,Economic Recovery Indicators,"Indications of economic recovery following the European debt crisis, with reports of growth and reduced unemployment, reflecting the effectiveness of previous economic policies."
Netherlands,2015,Climate Change Agreement,"Participation in international climate change negotiations, leading to significant commitments on reducing greenhouse gas emissions, underlining the country's leadership in environmental issues."
Netherlands,2015,Anti-Discrimination Law Update,"The government updated anti-discrimination laws, aiming to better protect minority groups and promote equality, reflecting ongoing social discussions on inclusion and rights."
Netherlands,2015,Technological Sector Achievement,"A Dutch technological firm achieved a significant milestone in innovation, reinforcing the Netherlands' reputation as a leader in technology and research."
Netherlands,2016,Environmental Policy,"The country adopted ambitious environmental policies aimed at significantly reducing greenhouse gas emissions by a future date, signaling a strong commitment to combating climate change."
Netherlands,2016,International Tribunal Ruling,"An international tribunal issued a ruling involving the Netherlands, which had significant implications for international law and maritime disputes, drawing considerable global attention."
Netherlands,2016,National Elections,"The country held national elections, leading to significant political shifts and discussions about immigration, national identity, and the European Union."
Netherlands,2016,Public Health Initiative,"A comprehensive public health initiative was launched, focusing on reducing smoking and promoting healthy living, highlighting the government's commitment to public health."
Netherlands,2016,Infrastructure Expansion,"Major infrastructure projects were announced, including the expansion of renewable energy facilities and transportation networks, to support sustainable development and economic growth."
Netherlands,2017,Cybersecurity Measures,"The government implemented significant cybersecurity measures to protect national infrastructure and combat cyber threats, reflecting the growing importance of digital security."
Netherlands,2017,Cultural Heritage Project,"A significant project was undertaken to preserve and promote Dutch cultural heritage, involving museums, archives, and educational programs, showcasing the country's commitment to its historical legacy."
Netherlands,2017,Agricultural Innovation,"The country advanced in agricultural innovation, developing sustainable farming techniques that garnered international interest and set new standards for food production and environmental stewardship."
Netherlands,2017,International Sports Event,"The Netherlands hosted an international sports event, showcasing its facilities and organizational capabilities, and promoting international cooperation through sports."
Netherlands,2017,Water Management Initiative,"A groundbreaking water management initiative was launched, addressing challenges related to sea level rise and flooding, and reinforcing the Netherlands' global leadership in water management solutions."
Netherlands,2018,Education Reform,"Significant education reforms were introduced, aimed at improving accessibility and quality of education across various levels, reflecting the country's commitment to educational excellence."
Netherlands,2018,Renewable Energy Project,"A major renewable energy project was inaugurated, marking a milestone in the country's transition towards sustainable energy sources and contributing to its climate goals."
Netherlands,2018,Science and Technology Advancement,"A significant advancement in science and technology was announced, underscoring the Netherlands' position as a leading innovator in research and development."
Netherlands,2018,Trade Agreement Negotiation,"The country played a key role in negotiating a major international trade agreement, impacting its economy and trade relations with significant global partners."
Netherlands,2018,Social Inclusion Effort,"Efforts to promote social inclusion and combat discrimination were intensified, including initiatives aimed at supporting marginalized communities and fostering a more inclusive society."
Netherlands,2019,Climate Protest,"Large-scale protests advocating for more aggressive action on climate change took place, reflecting growing public concern over environmental issues and government policy."
