Country,Year,Raw Event,Desc
Singapore,1990,Political Transition,"The nation underwent a significant political transition with the appointment of a new Prime Minister, marking the first change in leadership since its independence, aimed at ensuring stability and continuity in governance."
Singapore,1990,Economic Strategy Implementation,"The government launched a major economic initiative focused on transforming the country into a developed nation through innovation and technology, aiming to boost competitiveness and living standards."
Singapore,1990,Environmental Policy Enactment,"Introduction of stringent environmental regulations to tackle urban pollution, emphasizing sustainable development and enhancing the quality of urban life."
Singapore,1990,Healthcare Reform,"Major reforms were introduced in the healthcare system to improve accessibility and affordability, including the enhancement of medical facilities and services."
Singapore,1990,Cultural Festival Launch,"The inauguration of a major annual cultural festival aimed at celebrating diversity and promoting cultural heritage, enhancing the country's cultural landscape and tourism."
Singapore,1991,Housing Development Acceleration,"A significant acceleration in public housing development to meet the growing needs of the population, reinforcing the commitment to providing affordable housing solutions."
Singapore,1991,International Diplomatic Relations,"Strengthening of international relations through strategic partnerships, focusing on economic, security, and cultural exchanges to bolster the country’s global standing."
Singapore,1991,Educational System Enhancement,The implementation of major educational reforms aimed at raising educational standards and fostering a knowledge-based economy.
Singapore,1991,Public Transportation Expansion,"Expansion of the public transportation network, including the extension of mass rapid transit lines, to improve urban mobility and reduce congestion."
Singapore,1991,Water Resource Management,"The launch of an innovative water management strategy to ensure water sustainability and self-sufficiency, reflecting foresight in resource management."
Singapore,1992,Economic Liberalization Measures,"Introduction of policies to liberalize the economy, attract foreign investment, and promote private sector growth to diversify economic foundations."
Singapore,1992,Technological Advancement Initiatives,"Major initiatives to promote technological advancement and adoption across industries, aiming to position the country as a leader in technology and innovation."
Singapore,1992,National Service Program Enhancement,"Enhancement of the national service program to include more comprehensive training and skill development, emphasizing the importance of national defense and citizen preparedness."
Singapore,1992,Sports Infrastructure Development,"Development of sports facilities and hosting of international sporting events to promote health, sportsmanship, and international recognition."
Singapore,1992,Judicial System Reform,"Reforms in the judicial system to enhance efficiency, transparency, and the rule of law, strengthening the legal framework and public trust in governance."
Singapore,1993,International Airport Expansion,"Expansion of the international airport to increase capacity and improve facilities, bolstering the country’s status as a global aviation hub."
Singapore,1993,Financial Sector Enhancement,"Enhancement of the financial sector through regulatory reforms and the introduction of new financial services, aiming to make Singapore a leading global financial center."
Singapore,1993,Urban Redevelopment Initiative,"Launch of urban redevelopment projects to revitalize aging districts and improve living conditions, reflecting a proactive approach to urban planning."
Singapore,1993,Public Health Campaigns,"Implementation of public health campaigns focusing on preventive care and healthy living, aimed at improving population health and reducing healthcare costs."
Singapore,1993,International Trade Agreements,"Signing of strategic international trade agreements to open new markets and diversify trade relations, enhancing economic growth and stability."
Singapore,1994,Crime Prevention Measures,"Introduction of comprehensive crime prevention measures, focusing on community policing and public awareness to maintain public safety and security."
Singapore,1994,Environmental Sustainability Initiatives,"Launch of initiatives aimed at promoting environmental sustainability, including recycling programs and green building standards."
Singapore,1994,Labor Market Reforms,"Implementation of labor market reforms to improve workforce skills and flexibility, addressing the challenges of a dynamic global economy."
Singapore,1994,Telecommunications Liberalization,"Liberalization of the telecommunications sector to foster competition, innovation, and improved services for consumers."
Singapore,1994,Arts and Media Development,"Government support for the arts and media sectors to enhance cultural expression and develop local content, contributing to a vibrant cultural economy."
Singapore,1995,Anti-Corruption Campaign,Strengthening of anti-corruption laws and enforcement measures to uphold integrity and transparency in public life.
Singapore,1995,Regional Cooperation Initiatives,"Active participation in regional cooperation initiatives to enhance economic integration, security collaboration, and cultural exchange in Southeast Asia."
Singapore,1995,Public Sector Innovation,"Launch of programs to drive innovation in public services, utilizing technology to improve efficiency and service delivery."
Singapore,1995,Conservation Efforts,"Initiatives to conserve natural heritage and biodiversity, including the establishment of new nature reserves and parks."
Singapore,1995,Youth Engagement Strategy,"Introduction of programs to engage youth in national development, focusing on leadership, innovation, and community service."
Singapore,1996,Economic Expansion,"Continued economic growth with a focus on technology and financial services, attracting global companies and investments, contributing to the country's position as a leading Asian economic hub."
Singapore,1996,Public Health Initiative,"Introduction of new public health policies aimed at improving health care quality and accessibility, including advancements in hospital services and health promotion programs."
Singapore,1996,Environmental Legislation,"The government enacted stricter environmental laws to address urban pollution and promote sustainable development, impacting industries and public behaviors."
Singapore,1996,Education Reform,Implementation of significant reforms in the education system to enhance technological integration and global competitiveness of students.
Singapore,1996,Transport Infrastructure Enhancement,Expansion of the Mass Rapid Transit (MRT) system to improve urban mobility and support a growing population.
Singapore,1997,Financial Crisis Response,"Response to the Asian Financial Crisis with policies to stabilize the economy, protect jobs, and maintain financial stability, marking a critical period in Singapore's economic management."
Singapore,1997,Tourism Development,"Launch of initiatives to boost tourism, including the development of new attractions and international marketing campaigns, to diversify the economy and reduce dependence on traditional sectors."
Singapore,1997,International Diplomacy,"Hosting of key international summits, enhancing Singapore's role as a diplomatic hub and mediator in Southeast Asian political and economic issues."
Singapore,1997,National Security Enhancement,"Strengthening of national security measures in response to regional threats, focusing on maritime and cyber security."
Singapore,1997,Cultural Preservation,"Efforts to preserve and promote Singaporean culture and heritage amid globalization, including restoration of historic sites and festivals."
Singapore,1998,Economic Diversification,"Launch of initiatives to diversify the economy further into biotechnology and pharmaceuticals, aiming to establish new pillars of economic growth."
Singapore,1998,Public Housing Development,"Expansion of public housing projects to meet the demands of a growing population, emphasizing affordability and quality living conditions."
Singapore,1998,Water Sustainability Initiatives,Implementation of advanced water recycling and desalination technologies to ensure water sustainability and independence.
Singapore,1998,Digital Economy Promotion,"Promotion of the digital economy through initiatives to boost internet access and digital literacy, preparing the workforce for the future economy."
Singapore,1998,Sports Infrastructure Development,Development of new sports facilities and programs to promote active lifestyles and prepare for international sporting events.
Singapore,1999,Cybersecurity Measures,"Introduction of comprehensive cybersecurity measures to protect national infrastructure and corporate sectors, in response to the growing threat of cyber attacks."
Singapore,1999,Educational Technology Advancement,"Major investments in educational technology to integrate IT in schools, enhancing learning experiences and outcomes."
Singapore,1999,International Trade Agreements,"Negotiation and signing of several free trade agreements, enhancing Singapore’s economic ties and access to global markets."
Singapore,1999,Healthcare System Expansion,Opening of new healthcare facilities and introduction of health programs to address the needs of an aging population.
Singapore,1999,Arts and Media Development,"Government initiatives to develop the arts and media sectors, fostering a creative economy and enhancing cultural expression."
Singapore,2000,Millennium Celebrations,"Nationwide celebrations marking the new millennium, reflecting on Singapore's achievements and setting visions for the future."
Singapore,2000,Technological Innovation Hub Establishment,"Efforts to establish Singapore as a hub for technological innovation, including support for startups and R&D in cutting-edge technologies."
Singapore,2000,Environmental Sustainability Campaign,"Launch of a national campaign to promote environmental sustainability, focusing on recycling, green technology, and public education."
Singapore,2000,Public Transport Expansion,"Further expansion of the public transport network, including new MRT lines, to enhance connectivity and reduce reliance on private vehicles."
Singapore,2000,Youth Engagement Programs,"Introduction of programs to engage young people in national development, fostering a sense of identity and participation in civic duties."
Singapore,2001,Economic Recession,"Singapore faced an economic downturn due to the global IT slump, impacting local businesses and employment rates significantly."
Singapore,2001,Political Elections,"General elections were held, resulting in a continuation of the ruling party's dominance, reflecting the political stability and electorate's preferences in the country."
Singapore,2001,Educational Reform,"The government introduced reforms in the education system aimed at enhancing creativity and critical thinking among students, moving away from rote learning."
Singapore,2001,Disease Outbreak Response,"The government implemented stringent measures to manage the outbreak of foot-and-mouth disease, ensuring it did not impact the local agriculture and economy severely."
Singapore,2001,Air Defense Identification Zone Establishment,Singapore established its Air Defense Identification Zone to enhance national security and monitor its airspace more effectively.
Singapore,2002,Water Agreement Dispute,"Tensions arose over a long-standing water supply agreement with a neighboring country, impacting diplomatic relations and prompting discussions on water self-sufficiency."
Singapore,2002,Transportation Expansion,"The government expanded public transportation infrastructure, including the addition of new MRT lines, to improve urban mobility and reduce congestion."
Singapore,2002,Anti-Terrorism Measures,"In response to regional security threats, the government enacted new anti-terrorism laws and strengthened security protocols throughout the country."
Singapore,2002,Economic Diversification Efforts,"Initiatives were launched to diversify the economy into biotechnology and pharmaceuticals, aiming to reduce dependence on electronics manufacturing."
Singapore,2002,Innovation Promotion,"The government introduced incentives to promote research and development in technology and innovation sectors, aiming to position Singapore as a global innovation hub."
Singapore,2003,Severe Acute Respiratory Syndrome (SARS) Outbreak,"Singapore faced a major public health challenge with the outbreak of SARS, prompting nationwide health measures and impacting the economy, particularly tourism and retail."
Singapore,2003,Cybersecurity Strategy Implementation,The government implemented a comprehensive national cybersecurity strategy to protect critical information infrastructure and enhance cyber resilience.
Singapore,2003,Foreign Labor Policy Reform,"Changes were made to foreign labor policies, affecting work pass regulations to balance workforce needs and local employment."
Singapore,2003,Free Trade Agreements,"Several bilateral free trade agreements were signed, enhancing Singapore's economic ties and market access with key global economies."
Singapore,2003,Public Housing Development,"The government launched new initiatives to upgrade and build more public housing, improving living conditions and meeting the housing needs of the population."
Singapore,2004,Casino Legalization,"The government decided to legalize casinos, leading to the development of integrated resorts aimed at boosting tourism and creating jobs."
Singapore,2004,National Service Policy Enhancement,"Enhancements were made to the National Service policy, including improvements in training and benefits for servicemen, reinforcing defense capabilities and commitment to national security."
Singapore,2004,Intellectual Property Law Strengthening,"The intellectual property framework was strengthened to protect innovations and support the creative industries, enhancing Singapore's attractiveness to global businesses."
Singapore,2004,Environmental Sustainability Plan,"A long-term sustainability plan was launched, focusing on green growth and environmental protection, setting ambitious targets for energy efficiency and resource management."
Singapore,2004,Public Health Insurance Reform,Reforms were implemented in the public health insurance system to provide better coverage and more affordable healthcare options for residents.
Singapore,2005,National Identity Card Implementation,"A new biometric national identity card system was introduced, enhancing security features and integration with public services."
Singapore,2005,ASEAN Leadership,"Singapore assumed the chairmanship of ASEAN, playing a pivotal role in regional diplomacy and cooperation initiatives."
Singapore,2005,Education and Research Investment,Significant investments were made in educational and research institutions to foster a knowledge-based economy and support higher education.
Singapore,2005,Youth Olympic Games Bid,"Singapore launched its successful bid to host the inaugural Youth Olympic Games, aiming to enhance its global sporting reputation and inspire youth participation in sports."
Singapore,2005,Digital Economy Strategy,"The government unveiled a comprehensive strategy to promote the digital economy, focusing on e-governance, digital infrastructure, and tech entrepreneurship."
Singapore,2006,International Sports Event,"Singapore successfully hosted an international sporting event, boosting its profile on the global sports stage and promoting tourism."
Singapore,2006,Casino Approval,"The government approved the development of two integrated resorts with casinos, aiming to enhance tourism and create jobs, despite public debates about social impacts."
Singapore,2006,Biomedical Research Initiatives,"Increased investment in biomedical sciences, including opening new research facilities to position Singapore as a hub for medical research in Asia."
Singapore,2006,Public Transport Expansion,Expansion of the Mass Rapid Transit (MRT) system was announced to improve urban mobility and address the growing population's needs.
Singapore,2006,Environmental Policy,Introduction of stricter environmental regulations aimed at reducing air pollution and promoting sustainable urban living.
Singapore,2007,Education Reform,Implementation of significant reforms in the education sector to tailor learning experiences more closely to students' needs and strengths.
Singapore,2007,Water Sustainability Project,"Launch of a new initiative to enhance water sustainability, focusing on recycling and desalination to secure the water supply for future generations."
Singapore,2007,Financial Hub Development,"Establishment of new policies to strengthen Singapore’s position as a leading global financial hub, attracting more international banks and financial services."
Singapore,2007,Digital Media Advancement,Government investment in the digital media industry to diversify the economy and create new job opportunities in creative sectors.
Singapore,2007,Climate Change Strategy,"The government unveiled a national strategy to address climate change, focusing on reducing greenhouse gas emissions and promoting green technology."
Singapore,2008,Formula One Grand Prix,"Hosting of the first Formula One night race, enhancing Singapore's international profile and boosting its entertainment and tourism industries."
Singapore,2008,Economic Resilience Package,Introduction of an economic resilience package to cushion the impact of the global financial crisis on businesses and households.
Singapore,2008,Research and Development Investment,Increased funding for research and development in emerging technologies to foster innovation and maintain competitive edge.
Singapore,2008,Anti-Corruption Measures,Strengthening of anti-corruption laws and enforcement to maintain Singapore's reputation for governance and business transparency.
Singapore,2008,Public Health Initiative,Launch of a national health initiative aimed at improving population health through preventive care and public health education.
Singapore,2009,Pandemic Response,"Efficient handling of the H1N1 influenza pandemic through public health measures, showing the effectiveness of the city-state's healthcare and crisis management systems."
Singapore,2009,Youth Olympic Games Preparation,"Preparation to host the inaugural Youth Olympic Games, showcasing Singapore's capability in organizing international multi-sport events."
Singapore,2009,Public Housing Development,Announcement of extensive new public housing developments to meet the housing needs of a growing population.
Singapore,2009,Green Plan Update,"Update to the Singapore Green Plan, aiming to enhance sustainability practices across all sectors of the economy."
Singapore,2009,Transportation Infrastructure,"Continued expansion of the public transportation network, including the introduction of new MRT lines and bus services to improve connectivity."
Singapore,2010,Hosting Youth Olympic Games,"Successful hosting of the first Youth Olympic Games, highlighting Singapore’s capabilities in global sports event management and youth engagement."
Singapore,2010,Economic Recovery Measures,"Implementation of measures to ensure rapid economic recovery following the global financial crisis, focusing on innovation and competitiveness."
Singapore,2010,Population White Paper,Release of a white paper discussing future population strategies to balance growth and sustainability in the face of demographic changes.
Singapore,2010,Public Sector Innovation,Initiatives to drive innovation within the public sector to improve efficiency and service delivery using technology.
Singapore,2010,Environmental Sustainability Campaign,"Launch of a major campaign to promote environmental sustainability, encouraging green practices among individuals and businesses."
Singapore,2011,General Election,"A general election was held which saw the ruling party's share of the vote decline significantly, prompting discussions on political reform and greater electoral competition."
Singapore,2011,Public Transportation Enhancement,"The government announced major plans to expand and enhance the public transportation system, aiming to improve connectivity and reduce congestion."
Singapore,2011,Population White Paper Discussion,"Discussions began about a controversial white paper proposing to increase the population through immigration, sparking debates on national identity and infrastructure capacity."
Singapore,2011,Economic Strategy Update,"The government released an updated economic strategy aimed at ensuring long-term growth, focusing on productivity and innovation to maintain global competitiveness."
Singapore,2011,International Sports Event Hosting,"Singapore hosted a major international sports event, enhancing its global reputation as a venue for international sporting competitions."
Singapore,2012,Public Housing Policy Reform,"The government introduced significant reforms in public housing policies to make housing more affordable and accessible, responding to public concerns over rising costs."
Singapore,2012,Environmental Sustainability Plan,"A national plan was launched to promote environmental sustainability, focusing on green buildings, waste management, and energy efficiency."
Singapore,2012,Enhancement of Healthcare Services,"Expansion of healthcare services and facilities was announced, including new hospitals to cater to the growing and aging population."
Singapore,2012,Anti-Corruption Measures,"Increased efforts in anti-corruption were implemented, including stricter laws and regulations to uphold integrity among public officials."
Singapore,2012,Education System Enhancement,The education system was enhanced with the introduction of new curricula and learning approaches to foster critical thinking and creativity among students.
Singapore,2013,Air Quality Crisis,"The country experienced severe air pollution due to transboundary haze from forest fires in neighboring countries, affecting health and prompting regional cooperation on environmental issues."
Singapore,2013,Cybersecurity Strategy,The launch of a national cybersecurity strategy to protect critical information infrastructure and enhance IT security capabilities across sectors.
Singapore,2013,Water Sustainability Initiative,"New initiatives to enhance water sustainability were introduced, including the expansion of water reclamation and desalination facilities."
Singapore,2013,National Research Foundation,The government committed significant funding to the National Research Foundation to support research and development in key technological areas.
Singapore,2013,Wage Restructuring,Introduction of a progressive wage model in certain sectors to ensure fair wages and reduce income inequality.
Singapore,2014,Pioneer Generation Package,The introduction of the Pioneer Generation Package to honor the contributions of the elderly and provide them with healthcare benefits.
Singapore,2014,Digital Economy Promotion,"The government announced plans to promote the digital economy as part of its future economic strategy, focusing on building capabilities in digital technologies and e-commerce."
Singapore,2014,Labor Policy Enhancement,"New labor policies were introduced to ensure better protection and fairer treatment for workers, including measures to address the concerns of the growing freelance workforce."
Singapore,2014,Arts and Culture Development,"Significant investment was announced to develop arts and culture, aiming to strengthen Singapore’s identity and global cultural presence."
Singapore,2014,Regional Diplomacy,"Strengthening of regional diplomacy and security cooperation, with a focus on maritime security and counter-terrorism efforts."
Singapore,2015,Founding Leader's Death,"The country mourned the death of its founding leader, reflecting on his contributions to the nation's development and the future direction of the state."
Singapore,2015,Smart Nation Initiative,The launch of the Smart Nation initiative aimed at harnessing technology to improve living standards and create more opportunities in the digital age.
Singapore,2015,Southeast Asian Games Hosting,"Hosting of the Southeast Asian Games, which boosted national pride and showcased Singapore's capabilities in organizing large-scale international events."
Singapore,2015,Golden Jubilee Celebrations,"The celebration of Singapore’s 50 years of independence, marked by nationwide festivities, reflecting on the country’s progress and unity."
Singapore,2015,Global Financial Center Enhancement,"Steps were taken to further enhance Singapore's status as a global financial center, including regulatory improvements and initiatives to attract international financial services."
Singapore,2016,Rail System Upgrade,"Singapore launched significant upgrades to its rail system, including the addition of new trains and improvement in rail reliability, to enhance public transportation across the city-state."
Singapore,2016,Terrex Incident,"Nine Singaporean military vehicles were seized in Hong Kong, sparking diplomatic tensions between Singapore, China, and Hong Kong, and raising issues about military logistics and international law."
Singapore,2016,Anti-Money Laundering Measures,"In response to global financial scandals, Singapore tightened its anti-money laundering regulations, impacting banks and financial institutions across the country."
