Country,Year,Raw Event,Desc
Singapore,2016,Zika Virus Outbreak,"A Zika virus outbreak occurred in Singapore, leading to over 100 confirmed cases and prompting a vigorous mosquito control and public health response."
Singapore,2016,Presidential Election Changes,"The Singaporean government amended the Presidential Elections Act, reserving the 2017 election for candidates from the Malay community, aiming to ensure multiracial representation."
Singapore,2017,Public Transport Infrastructure Expansion,"Singapore opened the Downtown Line 3, significantly expanding the city's MRT network and improving connectivity in the eastern regions."
Singapore,2017,Cybersecurity Strategy Launch,The government launched its first national cybersecurity strategy to strengthen Singapore's defenses against a growing threat of cyber attacks.
Singapore,2017,Water Supply Agreement Discussion,"Discussions regarding the long-standing water supply agreement with Malaysia were revisited, emphasizing the importance of water security for Singapore."
Singapore,2017,Elected Presidency,"Halimah Yacob was elected as President, marking the first time the position was reserved for a candidate from the Malay community, enhancing racial harmony and representation."
Singapore,2017,Major Port Planning,"The government announced plans to consolidate its container port facilities at Tuas, aiming to create the world's largest container terminal in a bid to maintain its global maritime leadership."
Singapore,2018,Haze Management Measures,"Singapore implemented stricter air quality measures to manage the periodic haze affecting the city-state, caused by forest fires in neighboring Indonesia."
Singapore,2018,Historical Summit Hosting,"Singapore hosted a historic summit between the United States and North Korea, highlighting its role as a neutral venue for international diplomatic events."
Singapore,2018,Smart Nation Initiatives,"The Smart Nation Initiative was accelerated, involving the roll-out of digital government services and infrastructure to enhance the city-state's technological framework."
Singapore,2018,Property Cooling Measures,"The government introduced new property cooling measures to prevent the residential market from overheating, including higher stamp duties and tighter loan requirements."
Singapore,2018,Healthcare Cyber Attack,"A major cyber attack on Singapore's health database resulted in the theft of personal information of 1.5 million patients, underscoring the importance of cybersecurity."
Singapore,2019,Bicentennial Commemoration,Singapore marked the 200th anniversary of its founding in 1819 with a year-long series of events celebrating its history and diversity.
Singapore,2019,Fake News Law Enactment,The government enacted a controversial fake news law aimed at combating misinformation but criticized for potentially impinging on free speech.
Singapore,2019,Enhanced Retirement Age Announcement,The government announced plans to raise the retirement and re-employment ages to support an aging workforce and encourage longer career lifespans.
Singapore,2019,Restructuring of Key Industries,"Several key industries in Singapore, including electronics and pharmaceuticals, began restructuring to adapt to global economic changes and technological advancements."
Singapore,2019,Increased Focus on Mental Health,"The government increased its focus on mental health, initiating more comprehensive support and awareness programs amidst growing concerns about mental wellness in society."
Singapore,2020,COVID-19 Pandemic Response,"Singapore's response to the COVID-19 pandemic included early and aggressive testing, contact tracing, and a partial lockdown termed a ""circuit breaker"" to control virus spread."
Singapore,2020,General Election During Pandemic,"Singapore conducted a general election under strict health protocols due to the COVID-19 pandemic, which saw the ruling party retain power but with a reduced majority."
Singapore,2020,Foreign Worker Dormitories Issue,"The COVID-19 pandemic exposed significant issues in foreign worker dormitories, prompting nationwide efforts to improve living conditions and health protocols."
Singapore,2020,Green Plan 2030 Announcement,"The government announced the Singapore Green Plan 2030, aiming to advance sustainable development through renewable energy, green buildings, and reducing carbon emissions."
Singapore,2020,TraceTogether Program Expansion,"The TraceTogether program, essential for COVID-19 contact tracing, was expanded to include mandatory use in public venues, leveraging technology to manage public health."
Singapore,2021,Tech Industry Growth,"Accelerated growth in the technology sector, with significant investments in fintech, cybersecurity, and AI, positioning Singapore as a leading tech hub in Asia."
Singapore,2021,Green Plan 2030 Announced,"The Singapore Green Plan 2030 was launched, outlining ambitious sustainability goals aimed at reducing the environmental footprint and promoting green living in urban development."
Singapore,2021,Border Reopening,"Singapore gradually reopened its borders to international travelers with strict health protocols, revitalizing its tourism and aviation sectors after the pandemic-induced closures."
Singapore,2021,Vaccination Drive,"A nationwide COVID-19 vaccination campaign was initiated, aiming to achieve herd immunity, with special attention on vaccine accessibility and public health safety."
Singapore,2021,National Day Parade Delay,"The National Day Parade was postponed to ensure public safety amidst rising COVID-19 cases, reflecting the ongoing impact of the pandemic on large public events."
Singapore,2022,Introduction of Carbon Tax,"Implementation of a carbon tax aimed at reducing greenhouse gas emissions, influencing industries to adopt more sustainable practices and technologies."
Singapore,2022,Expansion of Digital Banks,The issuance of new digital banking licenses as part of a strategy to enhance the financial services landscape and foster innovation in digital finance.
Singapore,2022,Enhancement of Public Housing,"Launch of new initiatives to improve the quality and affordability of public housing, addressing the rising demand and ensuring sustainable urban living."
Singapore,2022,Strengthening Cybersecurity Measures,The government announced enhanced cybersecurity strategies to protect national digital infrastructure against increasing cyber threats.
Singapore,2022,Education Reform,"Introduction of reforms in the educational sector to emphasize critical thinking and creativity, reducing the focus on rote learning and exam performance."
Singapore,2023,Launch of Satellite,"The successful launch of a locally developed satellite, enhancing capabilities in space technology and data collection for environmental monitoring."
Singapore,2023,Implementation of Progressive Wage Model,"The Progressive Wage Model was implemented across more sectors, ensuring fair wages and career progression opportunities for workers in lower-wage categories."
Singapore,2023,Enhancement of Water Sustainability Practices,"Introduction of new technologies and policies to improve water sustainability, ensuring long-term water security and efficiency in usage."
Singapore,2023,Update to National Climate Change Strategy,"The government updated its national strategy on climate change, aiming to accelerate efforts in reducing carbon emissions and adapting to climate challenges."
Singapore,2023,Development of Green Buildings,"A new framework for the development of green buildings was introduced, aiming to reduce environmental impact and promote sustainable construction practices."
